Column1;article_url;article_canonical_url;article_slug;article_meta_title;article_meta_desc;article_date_published;article_date_modified;article_author;article_title;article_category;article_views;article_reading_time;article_content;article_raw_content;article_length;days_since_published;article_views_daily;article_views_monthly;website;scraping_date
https://www.mybeautifuljob.com/conseils-pour-trouver-un-emploi-dans-la-region-de-dole/;https://www.mybeautifuljob.com/conseils-pour-trouver-un-emploi-dans-la-region-de-dole/;https://www.mybeautifuljob.com/conseils-pour-trouver-un-emploi-dans-la-region-de-dole/;conseils-pour-trouver-un-emploi-dans-la-region-de-dole;Conseils pour trouver un emploi dans la région de Dole - My Beautiful Job;Au cœur de la région Bourgogne-Franche-Comté, la ville de Dole offre un cadre agréable et dynamique pour les personnes en quête d’opportunités professionnelles. Avec son patrimoine historique et son économie en plein essor, le bassin d’emploi local se développe et diversifie ses secteurs d’activité. Que vous soyez jeune diplômé, professionnel expérimenté ou en reconversion, la région doyenne regorge de possibilités pour décrocher un poste à la hauteur de vos aspirations. Pour mettre toutes les chances de votre côté et trouver un emploi dans la région de Dole, voici quelques conseils pratiques et astuces à prendre en considération lors de votre […];06/08/2023 02:01;06/08/2023 08:13;Watson; Conseils pour trouver un emploi dans la région de Dole;['Emploi', 'Emploi', 'Emploi', 'Emploi', 'Emploi', 'Emploi', 'Emploi', 'Formation', 'Formation', 'Formation', 'Business', 'Emploi'];1270;4.0;None;None;1;527;2.4053030303030303;72.1590909090909;https://www.mybeautifuljob.com;14/01/2025 22:17
https://www.mybeautifuljob.com/optimisation-de-la-productivite-des-employes-decouvrez-les-methodes-de-formation-les-plus-efficaces/;https://www.mybeautifuljob.com/optimisation-de-la-productivite-des-employes-decouvrez-les-methodes-de-formation-les-plus-efficaces/;https://www.mybeautifuljob.com/optimisation-de-la-productivite-des-employes-decouvrez-les-methodes-de-formation-les-plus-efficaces/;optimisation-de-la-productivite-des-employes-decouvrez-les-methodes-de-formation-les-plus-efficaces;Optimisation de la productivité des employés : Découvrez les méthodes de formation les plus efficaces - My Beautiful Job;Dans le monde effréné du travail contemporain, l’optimisation de la productivité des employés est une priorité pour de nombreuses organisations. L’efficacité d’un collaborateur peut être influencée par de nombreux facteurs, mais un élément clé est souvent la qualité de la formation qu’il reçoit. Toutefois, toutes les méthodes de formation ne se valent pas. Certaines sont nettement plus efficaces que d’autres pour améliorer la productivité. Ainsi, il devient crucial pour les entreprises de découvrir et d’implémenter les méthodes de formation les plus efficaces pour leurs employés afin d’optimiser leur rendement et de rester compétitives. Plan de l'articleFormation : les défis à […];05/08/2023 05:56;;Watson; Optimisation de la productivité des employés : Découvrez les méthodes de formation les plus efficaces;['Business', 'Business', 'Business', 'Business', 'Business', 'Business', 'Business', 'Emploi', 'Business', 'Actu', 'Business', 'Emploi'];1195;6.0;None;None;1;528;2.2589792060491494;67.76937618147448;https://www.mybeautifuljob.com;14/01/2025 22:17
https://www.mybeautifuljob.com/les-competences-essentielles-recherchees-par-les-employeurs-sur-le-marche-du-travail/;https://www.mybeautifuljob.com/les-competences-essentielles-recherchees-par-les-employeurs-sur-le-marche-du-travail/;https://www.mybeautifuljob.com/les-competences-essentielles-recherchees-par-les-employeurs-sur-le-marche-du-travail/;les-competences-essentielles-recherchees-par-les-employeurs-sur-le-marche-du-travail;Les compétences essentielles recherchées par les employeurs sur le marché du travail - My Beautiful Job;Naviguant dans le vaste océan du marché du travail, les employeurs cherchent à recruter des candidats dotés de compétences précieuses. Ces compétences, clés de la réussite professionnelle, peuvent varier selon le secteur et le poste. Toutefois, certaines d’entre elles sont universellement appréciées et recherchées par la plupart des recruteurs. À l’ère de la numérisation et de l’évolution constante des technologies, les compétences techniques sont très prisées. Les soft skills, comme la communication, la résolution de problèmes et le leadership, sont tout aussi essentielles. Ces compétences, combinées, forment le profil idéal pour un employé du XXIe siècle. Plan de l'articleCompétences techniques […];04/08/2023 05:22;;Watson; Les compétences essentielles recherchées par les employeurs sur le marché du travail;['Actu', 'Actu', 'Actu', 'Actu', 'Actu', 'Actu', 'Actu', 'Actu', 'Formation', 'Formation', 'Business', 'Emploi'];1271;9.0;None;None;1;529;2.3981132075471696;71.94339622641509;https://www.mybeautifuljob.com;14/01/2025 22:17
https://www.mybeautifuljob.com/formation-en-ligne-vs-formation-en-presentiel-decryptage-des-atouts-et-des-limites/;https://www.mybeautifuljob.com/formation-en-ligne-vs-formation-en-presentiel-decryptage-des-atouts-et-des-limites/;https://www.mybeautifuljob.com/formation-en-ligne-vs-formation-en-presentiel-decryptage-des-atouts-et-des-limites/;formation-en-ligne-vs-formation-en-presentiel-decryptage-des-atouts-et-des-limites;Formation en ligne vs formation en présentiel : décryptage des atouts et des limites - My Beautiful Job;L’ère numérique a radicalement transformé le paysage de l’éducation, avec l’essor de la formation en ligne qui donne un nouvel élan à l’apprentissage. La traditionnelle formation en présentiel conserve toujours sa place et ses avantages. D’une part, l’accessibilité et la flexibilité de la formation en ligne la rendent attrayante, mais d’autre part, l’interaction humaine et le réseau professionnel offerts par la formation en présentiel sont inégalables. Il est donc pertinent de décortiquer les atouts et les limitations de ces deux modes de formation pour aider les apprenants à faire un choix éclairé. Plan de l'articleFormation en ligne : avantages et […];03/08/2023 04:20;;Watson; Formation en ligne vs formation en présentiel : décryptage des atouts et des limites;['Formation', 'Formation', 'Formation', 'Formation', 'Formation', 'Formation', 'Formation', 'Business', 'Actu', 'Emploi', 'Business', 'Emploi'];1286;5.0;None;None;1;530;2.4218455743879472;72.65536723163842;https://www.mybeautifuljob.com;14/01/2025 22:17
https://www.mybeautifuljob.com/developper-ses-soft-skills-pour-une-meilleure-performance-professionnelle-grace-a-la-formation-continue/;https://www.mybeautifuljob.com/developper-ses-soft-skills-pour-une-meilleure-performance-professionnelle-grace-a-la-formation-continue/;https://www.mybeautifuljob.com/developper-ses-soft-skills-pour-une-meilleure-performance-professionnelle-grace-a-la-formation-continue/;developper-ses-soft-skills-pour-une-meilleure-performance-professionnelle-grace-a-la-formation-continue;Développer ses soft skills pour une meilleure performance professionnelle grâce à la formation continue - My Beautiful Job;"Dans le monde professionnel actuel, l’importance des compétences techniques ne peut être sous-estimée ; toutefois, l’accent mis sur les “soft skills” a aussi augmenté de manière significative. Ces compétences non techniques, qui englobent la communication, l’empathie, la résolution de problèmes et le leadership, sont devenues des éléments cruciaux pour une performance professionnelle optimale. La formation continue offre une plateforme idéale pour développer ces compétences essentielles. Grâce à divers programmes et modules spécifiquement conçus pour améliorer ces aspects, les employés peuvent affiner leurs propres compétences et contribuer de manière plus efficace à leur environnement de travail. Plan de l'articleLes soft skills […]";23/07/2023 02:01;23/07/2023 07:47;Watson; Développer ses soft skills pour une meilleure performance professionnelle grâce à la formation continue;['Business', 'Business', 'Business', 'Business', 'Business', 'Business', 'Business', 'Actu', 'Actu', 'Actu', 'Business', 'Emploi'];1322;4.0;None;None;1;541;2.4391143911439115;73.17343173431735;https://www.mybeautifuljob.com;14/01/2025 22:17
https://www.mybeautifuljob.com/lindispensable-formation-continue-pour-maintenir-son-expertise-a-jour/;https://www.mybeautifuljob.com/lindispensable-formation-continue-pour-maintenir-son-expertise-a-jour/;https://www.mybeautifuljob.com/lindispensable-formation-continue-pour-maintenir-son-expertise-a-jour/;lindispensable-formation-continue-pour-maintenir-son-expertise-a-jour;L'indispensable formation continue pour maintenir son expertise à jour - My Beautiful Job;Dans le paysage dynamique du XXIe siècle, le progrès technologique incessant et l’évolution rapide des connaissances requièrent une actualisation continue des compétences. La formation continue est devenue un instrument essentiel pour rester compétitif et maintenir son savoir-faire à la pointe. Elle est le moteur de l’apprentissage tout au long de la vie, permettant aux professionnels de tous horizons de rester en phase avec les dernières tendances et d’apporter une valeur ajoutée à leur travail. La formation continue n’est pas seulement un outil de développement personnel, mais aussi un moyen de stimuler l’innovation et la productivité dans un environnement professionnel. Plan […];24/07/2023 07:08;;Watson; L’indispensable formation continue pour maintenir son expertise à jour;['Actu', 'Actu', 'Actu', 'Actu', 'Actu', 'Actu', 'Actu', 'Formation', 'Formation', 'Formation', 'Business', 'Emploi'];1384;6.0;None;None;1;540;2.5582255083179297;76.74676524953789;https://www.mybeautifuljob.com;14/01/2025 22:17
https://www.mybeautifuljob.com/les-tendances-emergentes-en-formation-continue-qui-vous-garantiront-un-avantage-concurrentiel/;https://www.mybeautifuljob.com/les-tendances-emergentes-en-formation-continue-qui-vous-garantiront-un-avantage-concurrentiel/;https://www.mybeautifuljob.com/les-tendances-emergentes-en-formation-continue-qui-vous-garantiront-un-avantage-concurrentiel/;les-tendances-emergentes-en-formation-continue-qui-vous-garantiront-un-avantage-concurrentiel;Les tendances émergentes en formation continue qui vous garantiront un avantage concurrentiel - My Beautiful Job;Dans un monde en constante évolution, vous devez rester à jour avec les avancements et les tendances actuelles. Les domaines de la formation continue ne font pas exception à cette règle. De nouvelles approches pédagogiques, technologies et théories émergent constamment, offrant des opportunités pour améliorer les compétences et s’adapter à l’évolution des besoins du marché du travail. Comprendre et adopter ces tendances émergentes peut donner un avantage concurrentiel considérable, que ce soit dans le cadre d’une carrière individuelle ou dans le développement des ressources humaines d’une organisation. Plan de l'articleFormation continue : des approches pédagogiques innovantes pour réussirFormation continue : […];31/07/2023 02:01;31/07/2023 10:25;Watson; Les tendances émergentes en formation continue qui vous garantiront un avantage concurrentiel;['Actu', 'Actu', 'Actu', 'Actu', 'Actu', 'Actu', 'Actu', 'Emploi', 'Business', 'Emploi', 'Business', 'Emploi'];1337;9.0;None;None;1;533;2.5037453183520597;75.11235955056179;https://www.mybeautifuljob.com;14/01/2025 22:17
https://www.mybeautifuljob.com/optimiser-son-budget-formation-les-cles-pour-evaluer-son-retour-sur-investissement/;https://www.mybeautifuljob.com/optimiser-son-budget-formation-les-cles-pour-evaluer-son-retour-sur-investissement/;https://www.mybeautifuljob.com/optimiser-son-budget-formation-les-cles-pour-evaluer-son-retour-sur-investissement/;optimiser-son-budget-formation-les-cles-pour-evaluer-son-retour-sur-investissement;Optimiser son budget formation : les clés pour évaluer son retour sur investissement - My Beautiful Job;Dans un monde où la compétitivité et la performance sont devenues des enjeux majeurs pour les entreprises, la formation professionnelle des employés est essentielle pour assurer leur développement et leur pérennité. Effectivement, l’acquisition de nouvelles compétences et la montée en expertise des collaborateurs sont des leviers de croissance et d’innovation. Toutefois, compte tenu des contraintes budgétaires et financières auxquelles les organisations doivent faire face, il est crucial d’optimiser les ressources allouées à la formation et d’évaluer avec précision le retour sur investissement. Cela permettra de garantir que les efforts consentis pour la formation créent de la valeur ajoutée et contribuent […];23/07/2023 02:01;23/07/2023 07:47;Watson; Optimiser son budget formation : les clés pour évaluer son retour sur investissement;['Business', 'Business', 'Business', 'Business', 'Business', 'Business', 'Business', 'Formation', 'Business', 'Emploi', 'Business', 'Emploi'];1378;7.0;None;None;1;541;2.5424354243542435;76.2730627306273;https://www.mybeautifuljob.com;14/01/2025 22:17
https://www.mybeautifuljob.com/5-conseils-pour-devenir-coach-sportif/;https://www.mybeautifuljob.com/5-conseils-pour-devenir-coach-sportif/;https://www.mybeautifuljob.com/5-conseils-pour-devenir-coach-sportif/;5-conseils-pour-devenir-coach-sportif;5 conseils pour devenir coach sportif - My Beautiful Job;Vous souhaitez devenir coach sportif ? Découvrez les meilleurs conseils pour exercer ce métier.;17/07/2023 02:01;17/07/2023 11:49;Lynda; 5 conseils pour devenir coach sportif;['Formation', 'Formation', 'Formation', 'Formation', 'Formation', 'Formation', 'Formation', 'Formation', 'Emploi', 'Emploi', 'Business', 'Emploi'];1290;2.0;None;None;1;547;2.354014598540146;70.62043795620438;https://www.mybeautifuljob.com;14/01/2025 22:17
https://www.mybeautifuljob.com/les-principales-tendances-de-la-formation-professionnelle-continue-en-entreprise/;https://www.mybeautifuljob.com/les-principales-tendances-de-la-formation-professionnelle-continue-en-entreprise/;https://www.mybeautifuljob.com/les-principales-tendances-de-la-formation-professionnelle-continue-en-entreprise/;les-principales-tendances-de-la-formation-professionnelle-continue-en-entreprise;Les principales tendances de la formation professionnelle continue en entreprise - My Beautiful Job;Dans un monde en constante évolution, la formation professionnelle continue en entreprise revêt une importance cruciale pour assurer la compétitivité et la pérennité des organisations. Face aux défis du numérique, de l’intelligence artificielle et des nouvelles méthodes de travail, les employés et les employeurs doivent s’adapter et développer de nouvelles compétences. Plusieurs tendances majeures se dégagent dans ce domaine, notamment la digitalisation des formations, l’individualisation des parcours, l’accent sur les soft skills et le développement de l’apprentissage collaboratif. Ces tendances façonnent le paysage de la formation professionnelle continue et contribuent à la préparation des entreprises pour affronter les défis de […];17/07/2023 02:01;17/07/2023 10:37;Watson; Les principales tendances de la formation professionnelle continue en entreprise;['Actu', 'Actu', 'Actu', 'Actu', 'Actu', 'Actu', 'Actu', 'Emploi', 'Business', 'Business', 'Business', 'Emploi'];1386;15.0;None;None;1;547;2.5291970802919708;75.87591240875912;https://www.mybeautifuljob.com;14/01/2025 22:17
https://www.mybeautifuljob.com/les-tendances-actuelles-du-marche-du-travail-en-france/;https://www.mybeautifuljob.com/les-tendances-actuelles-du-marche-du-travail-en-france/;https://www.mybeautifuljob.com/les-tendances-actuelles-du-marche-du-travail-en-france/;les-tendances-actuelles-du-marche-du-travail-en-france;Les tendances actuelles du marché du travail en France - My Beautiful Job;Entre la crise de l’énergie, la guerre en Ukraine et l’inflation, 2022 a été marquée par une grande incertitude économique. Le marché du travail, dynamique depuis la pandémie, est de plus en plus confronté aux conséquences du ralentissement économique post-Covid. Cependant, selon les chiffres de l’Insee, en dépit de la baisse des revenus, le nombre d’emplois dans le secteur privé a augmenté d’environ 4% comparé au dernier trimestre de l’année 2019. Concernant le marché du travail français, il est en constante évolution, avec de nouvelles tendances actuelles qui se dessinent. A lire aussi : Quelle est la particularité d’un site […];17/07/2023 02:01;17/07/2023 10:02;Justin005; Les tendances actuelles du marché du travail en France;['Emploi', 'Emploi', 'Emploi', 'Emploi', 'Emploi', 'Emploi', 'Emploi', 'Emploi', 'Business', 'Formation', 'Business', 'Emploi'];1358;3.0;None;None;1;547;2.478102189781022;74.34306569343066;https://www.mybeautifuljob.com;14/01/2025 22:17
https://www.mybeautifuljob.com/les-avantages-des-formations-en-ligne-pour-se-former-efficacement-a-distance/;https://www.mybeautifuljob.com/les-avantages-des-formations-en-ligne-pour-se-former-efficacement-a-distance/;https://www.mybeautifuljob.com/les-avantages-des-formations-en-ligne-pour-se-former-efficacement-a-distance/;les-avantages-des-formations-en-ligne-pour-se-former-efficacement-a-distance;Les avantages des formations en ligne pour se former efficacement à distance - My Beautiful Job;Dans une ère technologique en constante évolution, les formations en ligne sont devenues un outil de choix pour l’acquisition de nouvelles compétences. Elles offrent une flexibilité inégalée, permettant aux apprenants de se former à leur propre rythme et selon leur propre emploi du temps. Ces formations peuvent être suivies depuis n’importe quel lieu, ce qui élimine les contraintes géographiques. Elles sont aussi souvent moins coûteuses que les formations traditionnelles, rendant l’éducation plus accessible à un plus grand nombre. L’interactivité offerte par les plateformes en ligne offre une expérience d’apprentissage plus engageante et personnalisée. Plan de l'articleFormation en ligne : flexibilité […];16/07/2023 03:39;;Watson; Les avantages des formations en ligne pour se former efficacement à distance;['Emploi', 'Emploi', 'Emploi', 'Emploi', 'Emploi', 'Emploi', 'Emploi', 'Business', 'Formation', 'Actu', 'Business', 'Emploi'];1288;5.0;None;None;1;548;2.3460837887067396;70.38251366120218;https://www.mybeautifuljob.com;14/01/2025 22:17
https://www.mybeautifuljob.com/les-cles-pour-trouver-la-formation-ideale-et-booster-votre-entreprise/;https://www.mybeautifuljob.com/les-cles-pour-trouver-la-formation-ideale-et-booster-votre-entreprise/;https://www.mybeautifuljob.com/les-cles-pour-trouver-la-formation-ideale-et-booster-votre-entreprise/;les-cles-pour-trouver-la-formation-ideale-et-booster-votre-entreprise;Les clés pour trouver la formation idéale et booster votre entreprise - My Beautiful Job;Dans le monde trépidant des entreprises d’aujourd’hui, l’apprentissage continu est un impératif. Le choix de la formation appropriée peut être un facteur déterminant pour propulser une entreprise vers de nouveaux sommets. L’investissement dans l’éducation et l’amélioration des compétences peut conduire à une productivité accrue, une innovation dynamique et un avantage concurrentiel solide. Plongeons dans les stratégies pour identifier la formation idéale qui peut catalyser la croissance de votre entreprise, en mettant l’accent sur l’identification des besoins de l’entreprise, la recherche des options de formation disponibles, l’évaluation de leur qualité et l’application de l’apprentissage dans la pratique. Identifier les besoins de […];16/07/2023 02:01;24/02/2024 13:36;Watson; Les clés pour trouver la formation idéale et booster votre entreprise;['Actu', 'Actu', 'Actu', 'Actu', 'Actu', 'Actu', 'Actu', 'Formation', 'Actu', 'Formation', 'Business', 'Emploi'];1350;4.0;None;None;1;548;2.459016393442623;73.77049180327869;https://www.mybeautifuljob.com;14/01/2025 22:17
https://www.mybeautifuljob.com/valoriser-ses-competences-acquises-en-formation-pour-booster-sa-carriere-professionnelle/;https://www.mybeautifuljob.com/valoriser-ses-competences-acquises-en-formation-pour-booster-sa-carriere-professionnelle/;https://www.mybeautifuljob.com/valoriser-ses-competences-acquises-en-formation-pour-booster-sa-carriere-professionnelle/;valoriser-ses-competences-acquises-en-formation-pour-booster-sa-carriere-professionnelle;Valoriser ses compétences acquises en formation pour booster sa carrière professionnelle - My Beautiful Job;Dans un monde professionnel en constante évolution, il est crucial pour les individus de se démarquer en mettant en avant leurs compétences acquises tout au long de leur parcours. Les formations sont un excellent moyen de développer de nouvelles aptitudes et d’accentuer leur employabilité. Effectivement, en investissant dans leur apprentissage, les individus peuvent non seulement élargir leur champ d’action, mais aussi accroître leur potentiel de réussite dans leur carrière. Valoriser les compétences acquises en formation est un atout majeur pour booster sa trajectoire professionnelle et se démarquer sur le marché du travail. Plan de l'articleFaire le point sur ses compétences […];16/07/2023 02:01;16/07/2023 07:58;Watson; Valoriser ses compétences acquises en formation pour booster sa carrière professionnelle;['Business', 'Business', 'Business', 'Business', 'Business', 'Business', 'Business', 'Formation', 'Formation', 'Formation', 'Business', 'Emploi'];1368;6.0;None;None;1;548;2.4918032786885247;74.75409836065575;https://www.mybeautifuljob.com;14/01/2025 22:17
https://www.mybeautifuljob.com/acquerir-les-competences-cles-en-formation-professionnelle-ce-que-vous-devez-savoir/;https://www.mybeautifuljob.com/acquerir-les-competences-cles-en-formation-professionnelle-ce-que-vous-devez-savoir/;https://www.mybeautifuljob.com/acquerir-les-competences-cles-en-formation-professionnelle-ce-que-vous-devez-savoir/;acquerir-les-competences-cles-en-formation-professionnelle-ce-que-vous-devez-savoir;Acquérir les compétences clés en formation professionnelle : ce que vous devez savoir - My Beautiful Job;Dans un monde en constante évolution, l’importance de la formation professionnelle ne peut être sous-estimée. Afin de rester compétitif sur le marché du travail et de répondre aux exigences croissantes des employeurs, il est important de bien posséder les compétences clés recherchées. Cela concerne aussi bien les personnes en début de carrière que celles souhaitant se réorienter ou monter en grade. Dans cette optique, il est essentiel de bien savoir pour se former efficacement et devenir un professionnel accompli. Plan de l'articleLa formation pro : l’importance des compétences clésFormation pro : les compétences clés à acquérirFormation pro : les moyens […];16/07/2023 02:01;16/07/2023 07:59;Watson; Acquérir les compétences clés en formation professionnelle : ce que vous devez savoir;['Actu', 'Actu', 'Actu', 'Actu', 'Actu', 'Actu', 'Actu', 'Formation', 'Formation', 'Business', 'Business', 'Emploi'];1390;6.0;None;None;1;548;2.5318761384335153;75.95628415300546;https://www.mybeautifuljob.com;14/01/2025 22:17
https://www.mybeautifuljob.com/decouvrez-les-metiers-accessibles-apres-un-bts-en-gestion-et-protection-de-la-nature/;https://www.mybeautifuljob.com/decouvrez-les-metiers-accessibles-apres-un-bts-en-gestion-et-protection-de-la-nature/;https://www.mybeautifuljob.com/decouvrez-les-metiers-accessibles-apres-un-bts-en-gestion-et-protection-de-la-nature/;decouvrez-les-metiers-accessibles-apres-un-bts-en-gestion-et-protection-de-la-nature;Découvrez les métiers accessibles après un BTS en gestion et protection de la nature - My Beautiful Job;Le BTSA GPN forme les étudiants à la gestion et à l’animation des espaces naturels et des territoires. De niveau III (BAC +2), il s’adresse à tous les étudiants qui souhaitent travailler dans le domaine de la gestion et de la protection de la nature. Le programme comporte généralement des modules en agronomie, sylviculture, pêche, chasse, paysage… À l’issue de cette formation, vous pourrez travailler dans des organismes de loisirs, des collectivités locales, des parcs et des réserves naturelles, etc. Zoom sur les métiers accessibles après un BTS en gestion et protection de la nature. A lire en complément : […];16/07/2023 02:01;16/07/2023 07:59;Justin005; Découvrez les métiers accessibles après un BTS en gestion et protection de la nature;['Formation', 'Formation', 'Formation', 'Formation', 'Formation', 'Formation', 'Formation', 'Emploi', 'Formation', 'Emploi', 'Business', 'Emploi'];1545;3.0;None;None;1;548;2.814207650273224;84.42622950819671;https://www.mybeautifuljob.com;14/01/2025 22:17
