Column1;article_url;article_canonical_url;article_slug;article_meta_title;article_meta_desc;article_date_published;article_date_modified;article_author;article_title;article_category;article_views;article_reading_time;article_content;article_raw_content;article_length;days_since_published;article_views_daily;article_views_monthly;website;scraping_date
https://www.mybeautifuljob.com/opticien-et-si-vous-deveniez-itinerant/;https://www.mybeautifuljob.com/opticien-et-si-vous-deveniez-itinerant/;https://www.mybeautifuljob.com/opticien-et-si-vous-deveniez-itinerant/;opticien-et-si-vous-deveniez-itinerant;Opticien : et si vous deveniez itinérant ? - My Beautiful Job;Le métier d’opticien est intéressant à plus d’un titre. Outre la possibilité de s’insérer rapidement dans le monde du travail, il permet de demeurer au contact de la clientèle. De plus, en tant qu’opticien, vous pouvez faire le choix d’exercer en indépendant. À ce propos, il faut dire que le métier s’est beaucoup modernisé. De fait, il est aujourd’hui possible de l’exercer en itinérant. Plus de flexibilité, plus de missions et des services personnalisés sont autant de points qui caractérisent ce mode de travail que nous vous présentons ici. Plan de l'articleComment un opticien itinérant travaille-t-il ?Quels sont les avantages […];24/11/2024 01:01;24/11/2024 15:15;Nico; Opticien : et si vous deveniez itinérant ?;['Business', 'Business', 'Business', 'Business', 'Business', 'Business', 'Business', 'Emploi', 'Actu', 'Emploi', 'Business', 'Emploi'];1182;3.0;None;None;1;51;22.73076923076923;681.9230769230769;https://www.mybeautifuljob.com;14/01/2025 22:17
https://www.mybeautifuljob.com/optimiser-sa-strategie-de-recrutement-grace-a-pole-emploi-conseils-et-astuces/;https://www.mybeautifuljob.com/optimiser-sa-strategie-de-recrutement-grace-a-pole-emploi-conseils-et-astuces/;https://www.mybeautifuljob.com/optimiser-sa-strategie-de-recrutement-grace-a-pole-emploi-conseils-et-astuces/;optimiser-sa-strategie-de-recrutement-grace-a-pole-emploi-conseils-et-astuces;Optimiser sa stratégie de recrutement grâce à Pôle emploi : conseils et astuces - My Beautiful Job;Les entreprises cherchent constamment à attirer les meilleurs talents. Utiliser les services de Pôle emploi peut s’avérer être une solution efficace. Cette agence publique dispose de nombreux outils pour aider les recruteurs à trouver les profils idéaux. En exploitant les fonctionnalités offertes, comme l’accès à une vaste base de données de candidats et la possibilité de diffuser des annonces ciblées, les employeurs peuvent affiner leur recherche. Pôle emploi propose des conseils personnalisés et des formations pour maximiser les chances de succès des recrutements. A découvrir également : Comment déposer un dossier de candidature avec ecandidat avignon ? Plan de l'articleUtiliser […];23/11/2024 02:00;;Watson; Optimiser sa stratégie de recrutement grâce à Pôle emploi : conseils et astuces;['Emploi', 'Emploi', 'Emploi', 'Emploi', 'Emploi', 'Emploi', 'Emploi', 'Business', 'Emploi', 'Actu', 'Business', 'Emploi'];212;4.0;None;None;1;52;4.0;120.0;https://www.mybeautifuljob.com;14/01/2025 22:17
https://www.mybeautifuljob.com/5-idees-de-reconversion-pour-un-metier-plus-epanouissant/;https://www.mybeautifuljob.com/5-idees-de-reconversion-pour-un-metier-plus-epanouissant/;https://www.mybeautifuljob.com/5-idees-de-reconversion-pour-un-metier-plus-epanouissant/;5-idees-de-reconversion-pour-un-metier-plus-epanouissant;5 idées de reconversion pour un métier plus épanouissant - My Beautiful Job;Il n’est jamais trop tard pour vous épanouir dans votre vie professionnelle. Si vous êtes à la recherche d’une nouvelle carrière, il existe de nombreuses manières d’opérer une reconversion. Voici 5 idées de reconversion professionnelle qui pourraient vous intéresser. Plan de l'articleFormez-vous en ligne au CAP fleuristeTrouvez une formation pour devenir assistant-vétérinaireDevenez aide-soignant en suivant une formationSuivez une formation pour être coiffeurChoisissez de vous reconvertir et devenir pâtissier Formez-vous en ligne au CAP fleuriste Le métier de fleuriste est une profession qui vous permet de travailler à votre compte ou dans une boutique de fleurs. Le fleuriste doit être créatif […];24/11/2024 01:01;24/11/2024 15:15;Nico; 5 idées de reconversion pour un métier plus épanouissant;['Actu', 'Actu', 'Actu', 'Actu', 'Actu', 'Actu', 'Actu', 'Business', 'Formation', 'Formation', 'Business', 'Emploi'];2235;6.0;None;None;1;51;42.98076923076923;1289.423076923077;https://www.mybeautifuljob.com;14/01/2025 22:17
https://www.mybeautifuljob.com/pourquoi-la-reconversion-professionnelle-est-plus-accessible-que-vous-ne-le-pensez/;https://www.mybeautifuljob.com/pourquoi-la-reconversion-professionnelle-est-plus-accessible-que-vous-ne-le-pensez/;https://www.mybeautifuljob.com/pourquoi-la-reconversion-professionnelle-est-plus-accessible-que-vous-ne-le-pensez/;pourquoi-la-reconversion-professionnelle-est-plus-accessible-que-vous-ne-le-pensez;Reconversion professionnelle accessible : démystifier les idées reçues;Changer de carrière peut sembler intimidant, mais les opportunités n’ont jamais été aussi nombreuses. Avec l’essor des formations en ligne, il est plus facile de se former à de nouvelles compétences tout en jonglant avec ses responsabilités actuelles. Les entreprises valorisent de plus en plus les parcours atypiques et les compétences transversales. Les réseaux professionnels et les plateformes de mentorat ouvrent des portes insoupçonnées. Le soutien d’une communauté et l’accès à des conseils avisés rendent le processus moins solitaire. Les aides gouvernementales et les dispositifs de financement permettent de surmonter les obstacles financiers. A découvrir également : Les meilleurs logiciels […];18/11/2024 01:40;28/10/2024 09:17;Watson; Pourquoi la reconversion professionnelle est plus accessible que vous ne le pensez;['Emploi', 'Emploi', 'Emploi', 'Emploi', 'Emploi', 'Emploi', 'Emploi', 'Emploi', 'Formation', 'Formation', 'Business', 'Emploi'];229;5.0;None;None;1;57;3.9482758620689653;118.44827586206895;https://www.mybeautifuljob.com;14/01/2025 22:17
https://www.mybeautifuljob.com/que-faut-il-savoir-concretement-par-rapport-a-lassistante-dentaire/;https://www.mybeautifuljob.com/que-faut-il-savoir-concretement-par-rapport-a-lassistante-dentaire/;https://www.mybeautifuljob.com/que-faut-il-savoir-concretement-par-rapport-a-lassistante-dentaire/;que-faut-il-savoir-concretement-par-rapport-a-lassistante-dentaire;Que faut-il savoir concrètement par rapport à l’assistante dentaire?? - My Beautiful Job;Le dentiste praticien n’est pas le seul professionnel à exercer dans son cabinet. En effet, celui-ci fait recours au service d’une assistante pour s’alléger la tâche. Celle-ci peut apporter un soutien technique et matériel au chirurgien-dentiste au cours de ses interventions. Quelles autres missions l’assistante dentaire assure-t-elle?? Quelle qualité doit-elle avoir pour exercer sa fonction?? Découvrez les réponses dans le présent article. A lire aussi : Industrie : le domaine de la supply chain est-il fait pour vous ? Plan de l'articleQuelles sont les tâches d’une assistante dentaire??Où peut-elle travailler??De quelles compétences une assistante dentaire a-t-elle besoin pour assurer efficacement […];18/11/2024 01:01;18/11/2024 11:10;Emmanuel; Que faut-il savoir concrètement par rapport à l’assistante dentaire??;['Emploi', 'Emploi', 'Emploi', 'Emploi', 'Emploi', 'Emploi', 'Emploi', 'Formation', 'Actu', 'Business', 'Business', 'Emploi'];1833;3.0;None;None;1;57;31.603448275862068;948.103448275862;https://www.mybeautifuljob.com;14/01/2025 22:17
https://www.mybeautifuljob.com/delai-de-prevenance-comment-le-calculer/;https://www.mybeautifuljob.com/delai-de-prevenance-comment-le-calculer/;https://www.mybeautifuljob.com/delai-de-prevenance-comment-le-calculer/;delai-de-prevenance-comment-le-calculer;Délai de prévenance : comment le calculer ? - My Beautiful Job;Le délai de prévenance est une obligation aussi bien pour l’employeur que pour l’employé. Il désigne la durée entre le moment de réception de l’information et son exécution. Il est tout de même susceptible de varier selon un bon nombre de critères. En d’autres termes, le délai de prévenance est un délai qu’il faut à tout prix respecter entre la notification et la concrétisation d’un événement. Il peut concerner une demande de réalisation d’heures supplémentaires ou le respect d’un nombre de jours avant la clôture de période d’essai. Comment le calculer ? Découvrez-le dans cet article. A voir aussi : Imprimeur […];12/01/2025 01:01;12/01/2025 15:36;Justin005; Délai de prévenance : comment le calculer ?;['Business', 'Business', 'Business', 'Business', 'Business', 'Business', 'Business', 'Emploi', 'Actu', 'Emploi', 'Business', 'Emploi'];2848;4.0;None;None;1;2;949.3333333333334;28480.0;https://www.mybeautifuljob.com;14/01/2025 22:17
https://www.mybeautifuljob.com/normes-hse-en-entreprise-comprendre-et-appliquer-les-regulations-de-sante-securite-et-environnement/;https://www.mybeautifuljob.com/normes-hse-en-entreprise-comprendre-et-appliquer-les-regulations-de-sante-securite-et-environnement/;https://www.mybeautifuljob.com/normes-hse-en-entreprise-comprendre-et-appliquer-les-regulations-de-sante-securite-et-environnement/;normes-hse-en-entreprise-comprendre-et-appliquer-les-regulations-de-sante-securite-et-environnement;Normes HSE en entreprise : comprendre et appliquer les régulations de santé, sécurité et environnement - My Beautiful Job;MT: Guide complet sur les normes HSE en entrepriseMD: Découvrez tout ce qu’il faut savoir sur les normes HSE en entreprise. La formation HSE à distance s’impose comme un outil précieux pour leur mise en œuvre. La conformité HSE (Hygiène Sécurité Environnement) est devenue un élément crucial de la gestion d’une entreprise moderne. Elle englobe un certain nombre de normes, de pratiques et de réglementations qui visent à réduire les risques professionnels. Il faut toutefois savoir que la mise en place d’une politique QHSE au sein d’une organisation peut s’avérer un enjeu de taille. Pour vous aider à mieux vous repérer, découvrez […];18/11/2024 01:01;18/11/2024 11:10;Emmanuel; Normes HSE en entreprise : comprendre et appliquer les régulations de santé, sécurité et environnement;['Business', 'Business', 'Business', 'Business', 'Business', 'Business', 'Business', 'Formation', 'Business', 'Formation', 'Business', 'Emploi'];502;7.0;None;None;1;57;8.655172413793103;259.6551724137931;https://www.mybeautifuljob.com;14/01/2025 22:17
https://www.mybeautifuljob.com/cours-de-maths-a-domicile-pourquoi-passer-par-aladom/;https://www.mybeautifuljob.com/cours-de-maths-a-domicile-pourquoi-passer-par-aladom/;https://www.mybeautifuljob.com/cours-de-maths-a-domicile-pourquoi-passer-par-aladom/;cours-de-maths-a-domicile-pourquoi-passer-par-aladom;Cours de maths à domicile : pourquoi passer par Aladom ? - My Beautiful Job;Si les maths s’invitent discrètement dans tous les domaines de la vie, elles ne sont pas les plus aimées de tous. Certains les trouvent bien difficiles sans savoir qu’en raisonnant, ils font déjà recours aux maths. En raison de son importance dans tous les cursus, il faudra que chacun rehausse son niveau en maths. Pour cela, vous devez trouver des cours à domiciles en maths. Où trouverez-vous les meilleurs professeurs ? Aladom répond à votre préoccupation.;18/11/2024 01:01;18/11/2024 11:10;Ibrahim006; Cours de maths à domicile : pourquoi passer par Aladom ?;['Actu', 'Actu', 'Actu', 'Actu', 'Actu', 'Actu', 'Actu', 'Emploi', 'Formation', 'Business', 'Business', 'Emploi'];2624;3.0;None;None;1;57;45.241379310344826;1357.2413793103447;https://www.mybeautifuljob.com;14/01/2025 22:17
https://www.mybeautifuljob.com/bts-commerce-international-explication-salaires-et-debouchees/;https://www.mybeautifuljob.com/bts-commerce-international-explication-salaires-et-debouchees/;https://www.mybeautifuljob.com/bts-commerce-international-explication-salaires-et-debouchees/;bts-commerce-international-explication-salaires-et-debouchees;BTS Commerce International : explication, salaires et débouchées - My Beautiful Job;Connu sous le sigle BTS CI, le BTS Commerce International est un diplôme accessible après un BAC ou un BAC pro. Il permet aux bacheliers d’avoir les notions nécessaires pour exercer sur le marché international, plus précisément dans le domaine du commerce. Très prisée, cette filière n’est malheureusement pas ouverte à tout le monde. Encadrée par des conditions d’éligibilité, elle offre aux apprenants des débouchées variées. Découvrez dans ce billet tout ce que vous devez savoir sur le BTS CI. A découvrir également : Les clés d'un programme de formation performant en entreprise Plan de l'articleQu’est-ce réellement le BTS Commerce […];15/12/2024 01:01;15/12/2024 15:18;Justin005; BTS Commerce International : explication, salaires et débouchées;['Business', 'Business', 'Business', 'Business', 'Business', 'Business', 'Business', 'Emploi', 'Emploi', 'Business', 'Business', 'Emploi'];2615;4.0;None;None;1;30;84.35483870967742;2530.645161290323;https://www.mybeautifuljob.com;14/01/2025 22:17
https://www.mybeautifuljob.com/developper-ses-competences-pour-acceder-a-de-nouvelles-opportunites-sur-le-marche-du-travail-a-strasbourg/;https://www.mybeautifuljob.com/developper-ses-competences-pour-acceder-a-de-nouvelles-opportunites-sur-le-marche-du-travail-a-strasbourg/;https://www.mybeautifuljob.com/developper-ses-competences-pour-acceder-a-de-nouvelles-opportunites-sur-le-marche-du-travail-a-strasbourg/;developper-ses-competences-pour-acceder-a-de-nouvelles-opportunites-sur-le-marche-du-travail-a-strasbourg;Développer ses compétences pour accéder à de nouvelles opportunités sur le marché du travail à Strasbourg - My Beautiful Job;Strasbourg, carrefour de l’Europe, se distingue par son dynamisme économique et ses nombreuses institutions internationales. Pour tirer parti de ces opportunités, il est important de bien renforcer ses compétences professionnelles. La ville propose une multitude de formations continues et d’ateliers, permettant à chacun de se perfectionner dans son domaine ou de se reconvertir. Les secteurs en plein essor, tels que la tech, la finance ou encore le développement durable, recherchent des profils qualifiés. En investissant dans l’apprentissage de nouvelles compétences, les travailleurs peuvent non seulement sécuriser leur emploi, mais aussi se positionner favorablement pour des postes plus avancés ou spécialisés. […];12/01/2025 01:34;19/12/2024 14:58;Watson; Développer ses compétences pour accéder à de nouvelles opportunités sur le marché du travail à Strasbourg;['Emploi', 'Emploi', 'Emploi', 'Emploi', 'Emploi', 'Emploi', 'Emploi', 'Formation', 'Business', 'Actu', 'Business', 'Emploi'];16;5.0;None;None;1;2;5.333333333333333;160.0;https://www.mybeautifuljob.com;14/01/2025 22:17
https://www.mybeautifuljob.com/comment-se-mettre-a-son-compte-sans-diplome/;https://www.mybeautifuljob.com/comment-se-mettre-a-son-compte-sans-diplome/;https://www.mybeautifuljob.com/comment-se-mettre-a-son-compte-sans-diplome/;comment-se-mettre-a-son-compte-sans-diplome;Comment se mettre à son compte sans diplôme ? - My Beautiful Job;Un auto-entrepreneur est une personne qui décide d’entreprendre sa passion indépendamment des risques, cela peut évidemment être fait sans avoir un diplôme universitaire ou beaucoup d’autres. Plusieurs personnes ont réussi à cet élan et même dans votre cas c’est possible. La question est quand, comment et quoi faire pour ne pas s’arrêter sur la route. Nous allons traiter avec plusieurs planches dans cette direction qui vous aidera à ne pas tomber dans certains pièges et faire face à des obstacles. Découvrez dans cet article comment devenir un auto-entrepreneur sans diplôme. A découvrir également : One to one en marketing : […];12/01/2025 01:01;12/01/2025 15:37;Tangi; Comment se mettre à son compte sans diplôme ?;['Business', 'Business', 'Business', 'Business', 'Business', 'Business', 'Business', 'Actu', 'Business', 'Emploi', 'Business', 'Emploi'];2605;9.0;None;None;1;2;868.3333333333334;26050.0;https://www.mybeautifuljob.com;14/01/2025 22:17
https://www.mybeautifuljob.com/lms-unice-astuces-pour-une-utilisation-optimale/;https://www.mybeautifuljob.com/lms-unice-astuces-pour-une-utilisation-optimale/;https://www.mybeautifuljob.com/lms-unice-astuces-pour-une-utilisation-optimale/;lms-unice-astuces-pour-une-utilisation-optimale;LMS Unice : astuces pour une utilisation optimale - My Beautiful Job;L’Université de Nice propose une plateforme de gestion de l’apprentissage (LMS) révolutionnaire. Pourtant, nombreux sont ceux qui peinent à en tirer pleinement profit. Cette interface, riche en fonctionnalités, peut sembler déroutante au premier abord. Pour exploiter tout son potentiel, quelques astuces simples suffisent. Organisez vos cours par catégories, utilisez les notifications pour ne rien manquer et explorez les forums pour échanger avec vos camarades. En adoptant ces pratiques, la navigation deviendra plus intuitive et l’accès aux ressources plus fluide. Lire également : L'art de la présentation visuelle : tableau à craie Esco et techniques infaillibles Optimiser l’utilisation de LMS Unice […];12/01/2025 01:01;12/01/2025 15:36;Watson; LMS Unice : astuces pour une utilisation optimale;['Formation', 'Formation', 'Formation', 'Formation', 'Formation', 'Formation', 'Formation', 'Formation', 'Formation', 'Emploi', 'Business', 'Emploi'];343;5.0;None;None;1;2;114.33333333333333;3430.0;https://www.mybeautifuljob.com;14/01/2025 22:17
https://www.mybeautifuljob.com/le-salaire-moyen-en-france-en-2021/;https://www.mybeautifuljob.com/le-salaire-moyen-en-france-en-2021/;https://www.mybeautifuljob.com/le-salaire-moyen-en-france-en-2021/;le-salaire-moyen-en-france-en-2021;Le salaire moyen en France en 2021 - My Beautiful Job;De nombreux indicateurs permettent d’évaluer le salaire moyen aujourd’hui en France. Les statistiques prennent notamment en compte le salaire net annuel et le salaire mensuel brut, deux valeurs qui reflètent l’état des lieux. Nous revenons pour vous sur les données fournies par l’Insee, l’Institut national de la statistique et des études économiques. Plan de l'articleQu’est-ce que le salaire moyen : définitionSalaire net annuel moyen et salaire net annuel médianLe montant du salaire moyen en FranceEvolution du salaire moyen en France sur 20 ans, par sexeUn fossé entre le salaire moyen des femmes et des hommesLe salaire net annuel moyen par […];29/12/2024 01:01;29/12/2024 15:07;Vero002; Le salaire moyen en France en 2021;['Actu', 'Actu', 'Actu', 'Actu', 'Actu', 'Actu', 'Actu', 'Actu', 'Actu', 'Business', 'Business', 'Emploi'];2799;15.0;None;None;1;16;164.64705882352942;4939.411764705883;https://www.mybeautifuljob.com;14/01/2025 22:17
https://www.mybeautifuljob.com/ages-bts-quels-sont-les-membres-les-plus-jeunes/;https://www.mybeautifuljob.com/ages-bts-quels-sont-les-membres-les-plus-jeunes/;https://www.mybeautifuljob.com/ages-bts-quels-sont-les-membres-les-plus-jeunes/;ages-bts-quels-sont-les-membres-les-plus-jeunes;Âges BTS : quels sont les membres les plus jeunes ? - My Beautiful Job;Le groupe BTS, icône mondiale de la K-pop, se distingue non seulement par son talent mais aussi par la jeunesse de certains de ses membres. Jungkook, souvent surnommé le ‘Golden Maknae’, est le plus jeune du groupe, étant né en 1997. Son énergie débordante et son impressionnante polyvalence en font un atout majeur. V est aussi parmi les plus jeunes, né en 1995. Sa voix profonde et son charisme unique lui ont valu une immense popularité. Ces jeunes artistes apportent une fraîcheur et une dynamique qui captivent des millions de fans à travers le globe. A lire également : Où […];12/01/2025 01:01;12/01/2025 15:36;Watson; Âges BTS : quels sont les membres les plus jeunes ?;['Formation', 'Formation', 'Formation', 'Formation', 'Formation', 'Formation', 'Formation', 'Emploi', 'Emploi', 'Formation', 'Business', 'Emploi'];444;4.0;None;None;1;2;148.0;4440.0;https://www.mybeautifuljob.com;14/01/2025 22:17
https://www.mybeautifuljob.com/limportance-cruciale-dun-tableau-des-metres-cubes-pour-evaluer-vos-volumes/;https://www.mybeautifuljob.com/limportance-cruciale-dun-tableau-des-metres-cubes-pour-evaluer-vos-volumes/;https://www.mybeautifuljob.com/limportance-cruciale-dun-tableau-des-metres-cubes-pour-evaluer-vos-volumes/;limportance-cruciale-dun-tableau-des-metres-cubes-pour-evaluer-vos-volumes;L'importance cruciale d'un tableau des mètres cubes pour évaluer vos volumes - My Beautiful Job;Dans le domaine de la logistique et de la gestion des espaces, maîtriser les volumes est essentiel pour optimiser les opérations. Le tableau des mètres cubes devient alors un outil indispensable pour évaluer avec précision les capacités de stockage ou les besoins en transport. Chaque mètre cube compte et une estimation erronée peut entraîner des coûts supplémentaires ou des inefficacités. Que ce soit pour un déménagement, l’aménagement d’un entrepôt ou la gestion des stocks, disposer d’un tableau des mètres cubes permet d’anticiper les besoins et de prendre des décisions éclairées. Cela garantit une utilisation optimale de l’espace et une gestion […];12/01/2025 01:01;12/01/2025 15:36;Watson; L’importance cruciale d’un tableau des mètres cubes pour évaluer vos volumes;['Business', 'Business', 'Business', 'Business', 'Business', 'Business', 'Business', 'Business', 'Emploi', 'Actu', 'Business', 'Emploi'];480;4.0;None;None;1;2;160.0;4800.0;https://www.mybeautifuljob.com;14/01/2025 22:17
https://www.mybeautifuljob.com/comprendre-le-prix-de-lessec-frais-de-scolarite-et-investissements/;https://www.mybeautifuljob.com/comprendre-le-prix-de-lessec-frais-de-scolarite-et-investissements/;https://www.mybeautifuljob.com/comprendre-le-prix-de-lessec-frais-de-scolarite-et-investissements/;comprendre-le-prix-de-lessec-frais-de-scolarite-et-investissements;Comprendre le prix de l'ESSEC : frais de scolarité et investissements - My Beautiful Job;L’ESSEC, école de commerce renommée, suscite souvent des interrogations concernant ses frais de scolarité. Les étudiants et leurs familles cherchent à comprendre pourquoi ces coûts sont si élevés et comment ils se justifient. En réalité, ces frais couvrent bien plus que le simple enseignement. L’investissement dans des infrastructures modernes, des programmes internationaux et des professeurs de renommée mondiale explique en partie ce prix. L’école met en œuvre des initiatives pour favoriser l’innovation et l’entrepreneuriat, offrant ainsi un environnement riche en opportunités. Pour beaucoup, ces investissements constituent une porte d’entrée vers des carrières prometteuses et internationales. A voir aussi : BTS […];12/01/2025 01:01;12/01/2025 15:36;Watson; Comprendre le prix de l’ESSEC : frais de scolarité et investissements;['Formation', 'Formation', 'Formation', 'Formation', 'Formation', 'Formation', 'Formation', 'Business', 'Emploi', 'Formation', 'Business', 'Emploi'];490;4.0;None;None;1;2;163.33333333333334;4900.0;https://www.mybeautifuljob.com;14/01/2025 22:17
https://www.mybeautifuljob.com/cours-de-maths-a-domicile-pourquoi-passer-par-aladom/;https://www.mybeautifuljob.com/cours-de-maths-a-domicile-pourquoi-passer-par-aladom/;https://www.mybeautifuljob.com/cours-de-maths-a-domicile-pourquoi-passer-par-aladom/;cours-de-maths-a-domicile-pourquoi-passer-par-aladom;Cours de maths à domicile : pourquoi passer par Aladom ? - My Beautiful Job;Si les maths s’invitent discrètement dans tous les domaines de la vie, elles ne sont pas les plus aimées de tous. Certains les trouvent bien difficiles sans savoir qu’en raisonnant, ils font déjà recours aux maths. En raison de son importance dans tous les cursus, il faudra que chacun rehausse son niveau en maths. Pour cela, vous devez trouver des cours à domiciles en maths. Où trouverez-vous les meilleurs professeurs ? Aladom répond à votre préoccupation.;18/11/2024 01:01;18/11/2024 11:10;Ibrahim006; Cours de maths à domicile : pourquoi passer par Aladom ?;['Actu', 'Actu', 'Actu', 'Actu', 'Actu', 'Actu', 'Actu', 'Emploi', 'Formation', 'Business', 'Business', 'Emploi'];2624;3.0;None;None;1;57;45.241379310344826;1357.2413793103447;https://www.mybeautifuljob.com;14/01/2025 22:17
