Column1;article_url;article_canonical_url;article_slug;article_meta_title;article_meta_desc;article_date_published;article_date_modified;article_author;article_title;article_category;article_views;article_reading_time;article_content;article_raw_content;article_length;days_since_published;article_views_daily;article_views_monthly;website;scraping_date
https://www.mybeautifuljob.com/ages-bts-quels-sont-les-membres-les-plus-jeunes/;https://www.mybeautifuljob.com/ages-bts-quels-sont-les-membres-les-plus-jeunes/;https://www.mybeautifuljob.com/ages-bts-quels-sont-les-membres-les-plus-jeunes/;ages-bts-quels-sont-les-membres-les-plus-jeunes;Âges BTS : quels sont les membres les plus jeunes ? - My Beautiful Job;Le groupe BTS, icône mondiale de la K-pop, se distingue non seulement par son talent mais aussi par la jeunesse de certains de ses membres. Jungkook, souvent surnommé le ‘Golden Maknae’, est le plus jeune du groupe, étant né en 1997. Son énergie débordante et son impressionnante polyvalence en font un atout majeur. V est aussi parmi les plus jeunes, né en 1995. Sa voix profonde et son charisme unique lui ont valu une immense popularité. Ces jeunes artistes apportent une fraîcheur et une dynamique qui captivent des millions de fans à travers le globe. A lire également : Où […];12/01/2025 01:01;12/01/2025 15:36;Watson; Âges BTS : quels sont les membres les plus jeunes ?;['Formation', 'Formation', 'Formation', 'Formation', 'Formation', 'Formation', 'Formation', 'Emploi', 'Emploi', 'Formation', 'Business', 'Emploi'];444;4.0;None;None;1;2;148.0;4440.0;https://www.mybeautifuljob.com;14/01/2025 22:17
https://www.mybeautifuljob.com/developper-ses-competences-pour-acceder-a-de-nouvelles-opportunites-sur-le-marche-du-travail-a-strasbourg/;https://www.mybeautifuljob.com/developper-ses-competences-pour-acceder-a-de-nouvelles-opportunites-sur-le-marche-du-travail-a-strasbourg/;https://www.mybeautifuljob.com/developper-ses-competences-pour-acceder-a-de-nouvelles-opportunites-sur-le-marche-du-travail-a-strasbourg/;developper-ses-competences-pour-acceder-a-de-nouvelles-opportunites-sur-le-marche-du-travail-a-strasbourg;Développer ses compétences pour accéder à de nouvelles opportunités sur le marché du travail à Strasbourg - My Beautiful Job;Strasbourg, carrefour de l’Europe, se distingue par son dynamisme économique et ses nombreuses institutions internationales. Pour tirer parti de ces opportunités, il est important de bien renforcer ses compétences professionnelles. La ville propose une multitude de formations continues et d’ateliers, permettant à chacun de se perfectionner dans son domaine ou de se reconvertir. Les secteurs en plein essor, tels que la tech, la finance ou encore le développement durable, recherchent des profils qualifiés. En investissant dans l’apprentissage de nouvelles compétences, les travailleurs peuvent non seulement sécuriser leur emploi, mais aussi se positionner favorablement pour des postes plus avancés ou spécialisés. […];12/01/2025 01:34;19/12/2024 14:58;Watson; Développer ses compétences pour accéder à de nouvelles opportunités sur le marché du travail à Strasbourg;['Emploi', 'Emploi', 'Emploi', 'Emploi', 'Emploi', 'Emploi', 'Emploi', 'Formation', 'Business', 'Actu', 'Business', 'Emploi'];16;5.0;None;None;1;2;5.333333333333333;160.0;https://www.mybeautifuljob.com;14/01/2025 22:17
https://www.mybeautifuljob.com/lms-unice-astuces-pour-une-utilisation-optimale/;https://www.mybeautifuljob.com/lms-unice-astuces-pour-une-utilisation-optimale/;https://www.mybeautifuljob.com/lms-unice-astuces-pour-une-utilisation-optimale/;lms-unice-astuces-pour-une-utilisation-optimale;LMS Unice : astuces pour une utilisation optimale - My Beautiful Job;L’Université de Nice propose une plateforme de gestion de l’apprentissage (LMS) révolutionnaire. Pourtant, nombreux sont ceux qui peinent à en tirer pleinement profit. Cette interface, riche en fonctionnalités, peut sembler déroutante au premier abord. Pour exploiter tout son potentiel, quelques astuces simples suffisent. Organisez vos cours par catégories, utilisez les notifications pour ne rien manquer et explorez les forums pour échanger avec vos camarades. En adoptant ces pratiques, la navigation deviendra plus intuitive et l’accès aux ressources plus fluide. Lire également : L'art de la présentation visuelle : tableau à craie Esco et techniques infaillibles Optimiser l’utilisation de LMS Unice […];12/01/2025 01:01;12/01/2025 15:36;Watson; LMS Unice : astuces pour une utilisation optimale;['Formation', 'Formation', 'Formation', 'Formation', 'Formation', 'Formation', 'Formation', 'Formation', 'Formation', 'Emploi', 'Business', 'Emploi'];343;5.0;None;None;1;2;114.33333333333333;3430.0;https://www.mybeautifuljob.com;14/01/2025 22:17
https://www.mybeautifuljob.com/limportance-cruciale-dun-tableau-des-metres-cubes-pour-evaluer-vos-volumes/;https://www.mybeautifuljob.com/limportance-cruciale-dun-tableau-des-metres-cubes-pour-evaluer-vos-volumes/;https://www.mybeautifuljob.com/limportance-cruciale-dun-tableau-des-metres-cubes-pour-evaluer-vos-volumes/;limportance-cruciale-dun-tableau-des-metres-cubes-pour-evaluer-vos-volumes;L'importance cruciale d'un tableau des mètres cubes pour évaluer vos volumes - My Beautiful Job;Dans le domaine de la logistique et de la gestion des espaces, maîtriser les volumes est essentiel pour optimiser les opérations. Le tableau des mètres cubes devient alors un outil indispensable pour évaluer avec précision les capacités de stockage ou les besoins en transport. Chaque mètre cube compte et une estimation erronée peut entraîner des coûts supplémentaires ou des inefficacités. Que ce soit pour un déménagement, l’aménagement d’un entrepôt ou la gestion des stocks, disposer d’un tableau des mètres cubes permet d’anticiper les besoins et de prendre des décisions éclairées. Cela garantit une utilisation optimale de l’espace et une gestion […];12/01/2025 01:01;12/01/2025 15:36;Watson; L’importance cruciale d’un tableau des mètres cubes pour évaluer vos volumes;['Business', 'Business', 'Business', 'Business', 'Business', 'Business', 'Business', 'Business', 'Emploi', 'Actu', 'Business', 'Emploi'];480;4.0;None;None;1;2;160.0;4800.0;https://www.mybeautifuljob.com;14/01/2025 22:17
https://www.mybeautifuljob.com/comprendre-le-prix-de-lessec-frais-de-scolarite-et-investissements/;https://www.mybeautifuljob.com/comprendre-le-prix-de-lessec-frais-de-scolarite-et-investissements/;https://www.mybeautifuljob.com/comprendre-le-prix-de-lessec-frais-de-scolarite-et-investissements/;comprendre-le-prix-de-lessec-frais-de-scolarite-et-investissements;Comprendre le prix de l'ESSEC : frais de scolarité et investissements - My Beautiful Job;L’ESSEC, école de commerce renommée, suscite souvent des interrogations concernant ses frais de scolarité. Les étudiants et leurs familles cherchent à comprendre pourquoi ces coûts sont si élevés et comment ils se justifient. En réalité, ces frais couvrent bien plus que le simple enseignement. L’investissement dans des infrastructures modernes, des programmes internationaux et des professeurs de renommée mondiale explique en partie ce prix. L’école met en œuvre des initiatives pour favoriser l’innovation et l’entrepreneuriat, offrant ainsi un environnement riche en opportunités. Pour beaucoup, ces investissements constituent une porte d’entrée vers des carrières prometteuses et internationales. A voir aussi : BTS […];12/01/2025 01:01;12/01/2025 15:36;Watson; Comprendre le prix de l’ESSEC : frais de scolarité et investissements;['Formation', 'Formation', 'Formation', 'Formation', 'Formation', 'Formation', 'Formation', 'Business', 'Emploi', 'Formation', 'Business', 'Emploi'];490;4.0;None;None;1;2;163.33333333333334;4900.0;https://www.mybeautifuljob.com;14/01/2025 22:17
https://www.mybeautifuljob.com/salaire-de-testeur-de-toboggans-une-retribution-ludique-mais-lucrative/;https://www.mybeautifuljob.com/salaire-de-testeur-de-toboggans-une-retribution-ludique-mais-lucrative/;https://www.mybeautifuljob.com/salaire-de-testeur-de-toboggans-une-retribution-ludique-mais-lucrative/;salaire-de-testeur-de-toboggans-une-retribution-ludique-mais-lucrative;Salaire de testeur de toboggans : une rétribution ludique mais lucrative ? - My Beautiful Job;Le métier de testeur de toboggans, souvent perçu comme un rêve d’enfant devenu réalité, cache une réalité professionnelle bien distincte. Ce travail insolite consiste à évaluer la sécurité et le plaisir procuré par divers toboggans aquatiques à travers le monde. Les testeurs doivent juger de la conception, des matériaux utilisés et de la fluidité des descentes. Surprenant pour certains, ce métier ludique offre une rémunération attractive. Les salaires peuvent atteindre plusieurs milliers d’euros par mois, en fonction de l’expérience et des missions. Une combinaison idéale pour ceux qui cherchent à allier passion et profession. A lire aussi : Que faut-il […];12/01/2025 01:01;12/01/2025 15:36;Watson; Salaire de testeur de toboggans : une rétribution ludique mais lucrative ?;['Emploi', 'Emploi', 'Emploi', 'Emploi', 'Emploi', 'Emploi', 'Emploi', 'Actu', 'Emploi', 'Formation', 'Business', 'Emploi'];543;4.0;None;None;1;2;181.0;5430.0;https://www.mybeautifuljob.com;14/01/2025 22:17
https://www.mybeautifuljob.com/messagerie-academique-de-lyon-guide-exhaustif-pour-les-nouveaux-utilisateurs/;https://www.mybeautifuljob.com/messagerie-academique-de-lyon-guide-exhaustif-pour-les-nouveaux-utilisateurs/;https://www.mybeautifuljob.com/messagerie-academique-de-lyon-guide-exhaustif-pour-les-nouveaux-utilisateurs/;messagerie-academique-de-lyon-guide-exhaustif-pour-les-nouveaux-utilisateurs;Messagerie académique de Lyon : guide exhaustif pour les nouveaux utilisateurs - My Beautiful Job;Les nouveaux venus à l’Université de Lyon peuvent parfois se sentir submergés par la multitude de services numériques à leur disposition. La messagerie académique, un outil essentiel pour la communication interne, représente souvent un défi pour ceux qui ne sont pas familiers avec son fonctionnement. Ce guide a pour but d’aider les étudiants et le personnel à naviguer efficacement dans leur messagerie académique. De la création de votre compte à l’organisation de votre boîte de réception, en passant par la gestion des paramètres de confidentialité, chaque aspect est couvert pour garantir une expérience utilisateur optimale et sans stress. A lire […];12/01/2025 01:01;12/01/2025 15:36;Watson; Messagerie académique de Lyon : guide exhaustif pour les nouveaux utilisateurs;['Formation', 'Formation', 'Formation', 'Formation', 'Formation', 'Formation', 'Formation', 'Formation', 'Emploi', 'Emploi', 'Business', 'Emploi'];544;4.0;None;None;1;2;181.33333333333334;5440.0;https://www.mybeautifuljob.com;14/01/2025 22:17
https://www.mybeautifuljob.com/nero-educ-plateforme-de-formation/;https://www.mybeautifuljob.com/nero-educ-plateforme-de-formation/;https://www.mybeautifuljob.com/nero-educ-plateforme-de-formation/;nero-educ-plateforme-de-formation;Nero Educ : plateforme de formation - My Beautiful Job;La montée en puissance des technologies numériques transforme le paysage éducatif. Nero Educ se positionne comme une plateforme de formation innovante, répondant aux besoins actuels des apprenants et des professionnels. Offrant une multitude de cours en ligne, elle couvre des domaines variés, allant des compétences techniques à l’intelligence émotionnelle. Accessible à tous, Nero Educ utilise des méthodes d’enseignement interactives et personnalisées. Les utilisateurs peuvent progresser à leur rythme, grâce à des modules adaptatifs et des évaluations continues. Cette flexibilité permet de concilier apprentissage et vie quotidienne, tout en assurant une acquisition de compétences solide et durable. A lire aussi : […];12/01/2025 01:01;12/01/2025 15:36;Watson; Nero Educ : plateforme de formation;['Formation', 'Formation', 'Formation', 'Formation', 'Formation', 'Formation', 'Formation', 'Actu', 'Formation', 'Actu', 'Business', 'Emploi'];530;5.0;None;None;1;2;176.66666666666666;5300.0;https://www.mybeautifuljob.com;14/01/2025 22:17
https://www.mybeautifuljob.com/comment-mycampus-eduservices-transforme-la-gestion-de-votre-parcours-educatif/;https://www.mybeautifuljob.com/comment-mycampus-eduservices-transforme-la-gestion-de-votre-parcours-educatif/;https://www.mybeautifuljob.com/comment-mycampus-eduservices-transforme-la-gestion-de-votre-parcours-educatif/;comment-mycampus-eduservices-transforme-la-gestion-de-votre-parcours-educatif;Comment MyCampus Eduservices transforme la gestion de votre parcours éducatif - My Beautiful Job;MyCampus Eduservices révolutionne la manière dont les étudiants gèrent leur parcours éducatif. En intégrant des outils numériques innovants, cette plateforme permet une gestion centralisée et personnalisée des cours, des résultats et des interactions pédagogiques. Les étudiants peuvent ainsi suivre leur progression en temps réel, accéder à des ressources spécifiques et recevoir des notifications pour les échéances importantes. Cette approche facilite aussi la communication entre les élèves et les enseignants. Les forums de discussion, les messageries instantanées et les espaces de collaboration en ligne favorisent un apprentissage plus dynamique et interactif. MyCampus Eduservices met ainsi la technologie au service de l’éducation, […];12/01/2025 01:01;12/01/2025 15:36;Watson; Comment MyCampus Eduservices transforme la gestion de votre parcours éducatif;['Formation', 'Formation', 'Formation', 'Formation', 'Formation', 'Formation', 'Formation', 'Actu', 'Actu', 'Formation', 'Business', 'Emploi'];661;5.0;None;None;1;2;220.33333333333334;6610.0;https://www.mybeautifuljob.com;14/01/2025 22:17
https://www.mybeautifuljob.com/prix-formation-125-cout-et-details-pour-conduire-un-scooter-ou-moto-legere/;https://www.mybeautifuljob.com/prix-formation-125-cout-et-details-pour-conduire-un-scooter-ou-moto-legere/;https://www.mybeautifuljob.com/prix-formation-125-cout-et-details-pour-conduire-un-scooter-ou-moto-legere/;prix-formation-125-cout-et-details-pour-conduire-un-scooter-ou-moto-legere;Prix formation 125 : coût et détails pour conduire un scooter ou moto légère - My Beautiful Job;Face à un intérêt croissant pour la mobilité urbaine et les alternatives aux véhicules traditionnels, la formation 125 cc devient un passage obligé pour les amateurs de deux-roues désirant piloter un scooter ou une moto légère. Cette formation, qui s’adresse aux détenteurs du permis B souhaitant conduire un véhicule de cette catégorie, est à la fois une question de sécurité et de conformité à la législation. Le coût de cette formation peut varier selon plusieurs facteurs, incluant le centre de formation choisi, la région, ainsi que les éventuels frais supplémentaires pour le matériel ou les supports de cours. Plan de […];12/01/2025 01:01;12/01/2025 15:36;Watson; Prix formation 125 : coût et détails pour conduire un scooter ou moto légère;['Formation', 'Formation', 'Formation', 'Formation', 'Formation', 'Formation', 'Formation', 'Formation', 'Formation', 'Emploi', 'Business', 'Emploi'];857;6.0;None;None;1;2;285.6666666666667;8570.0;https://www.mybeautifuljob.com;14/01/2025 22:17
https://www.mybeautifuljob.com/comment-etre-pro-actif-au-travail/;https://www.mybeautifuljob.com/comment-etre-pro-actif-au-travail/;https://www.mybeautifuljob.com/comment-etre-pro-actif-au-travail/;comment-etre-pro-actif-au-travail;Comment être pro actif au travail ? - My Beautiful Job;« Soyez proactif » ! Il est difficile de manquer ce concept ces jours.Alors, quel sens à cet adjectif que nous rencontrons si souvent ? Et d’ailleurs comment le mettre en avant dans l’entretien ? Plan de l'articlePetite définitionComment être proactif dans la maintenance ?SolutionQAPA Petite définition L’ adjectif proactif vient de l’anglais « proactif ». Il décrit une personne qui prend sa vie en main et refuse de se laisser mener par des événements extérieurs. Mais aujourd’hui, il peut avoir un autre sens. Il est utilisé aujourd’hui dans un sens plus large, pour parler de quelqu’un qui serait capable d’anticiper certains événements dans le contexte professionnel. A […];12/01/2025 01:01;12/01/2025 15:37;Tangi; Comment être pro actif au travail ?;['Emploi', 'Emploi', 'Emploi', 'Emploi', 'Emploi', 'Emploi', 'Emploi', 'Emploi', 'Business', 'Emploi', 'Business', 'Emploi'];2383;2.0;None;None;1;2;794.3333333333334;23830.0;https://www.mybeautifuljob.com;14/01/2025 22:17
https://www.mybeautifuljob.com/delai-de-prevenance-comment-le-calculer/;https://www.mybeautifuljob.com/delai-de-prevenance-comment-le-calculer/;https://www.mybeautifuljob.com/delai-de-prevenance-comment-le-calculer/;delai-de-prevenance-comment-le-calculer;Délai de prévenance : comment le calculer ? - My Beautiful Job;Le délai de prévenance est une obligation aussi bien pour l’employeur que pour l’employé. Il désigne la durée entre le moment de réception de l’information et son exécution. Il est tout de même susceptible de varier selon un bon nombre de critères. En d’autres termes, le délai de prévenance est un délai qu’il faut à tout prix respecter entre la notification et la concrétisation d’un événement. Il peut concerner une demande de réalisation d’heures supplémentaires ou le respect d’un nombre de jours avant la clôture de période d’essai. Comment le calculer ? Découvrez-le dans cet article. A voir aussi : Imprimeur […];12/01/2025 01:01;12/01/2025 15:36;Justin005; Délai de prévenance : comment le calculer ?;['Business', 'Business', 'Business', 'Business', 'Business', 'Business', 'Business', 'Emploi', 'Actu', 'Emploi', 'Business', 'Emploi'];2848;4.0;None;None;1;2;949.3333333333334;28480.0;https://www.mybeautifuljob.com;14/01/2025 22:17
https://www.mybeautifuljob.com/langlais-au-travail-un-atout-non-negligeable/;https://www.mybeautifuljob.com/langlais-au-travail-un-atout-non-negligeable/;https://www.mybeautifuljob.com/langlais-au-travail-un-atout-non-negligeable/;langlais-au-travail-un-atout-non-negligeable;L’anglais au travail : un atout non négligeable - My Beautiful Job;"Parler anglais est un avantage à bien des égards, dans la vie de tous les jours ou en voyage. Mais c’est aussi un atout considérable dans le monde du travail ; que ce soit pour se faire recruter pour un nouveau poste, ou pour obtenir de nouvelles opportunités en interne. Selon une étude, 48% des Français ont aujourd’hui à utiliser l’anglais au travail. Pourtant, nombreux sont ceux qui estiment ne pas avoir un niveau d’anglais suffisant pour échanger et interagir en toute confiance dans la langue de Shakespeare. Lire également : Comment bien recruter dans l'immobilier ? Pour s’améliorer, le […]";12/01/2025 01:01;12/01/2025 15:36;smartuser; L’anglais au travail : un atout non négligeable;['Actu', 'Actu', 'Actu', 'Actu', 'Actu', 'Actu', 'Actu', 'Actu', 'Business', 'Formation', 'Business', 'Emploi'];1944;3.0;None;None;1;2;648.0;19440.0;https://www.mybeautifuljob.com;14/01/2025 22:17
https://www.mybeautifuljob.com/les-metiers-en-vogue-explorer-les-secteurs-porteurs-pour-une-reconversion-professionnelle/;https://www.mybeautifuljob.com/les-metiers-en-vogue-explorer-les-secteurs-porteurs-pour-une-reconversion-professionnelle/;https://www.mybeautifuljob.com/les-metiers-en-vogue-explorer-les-secteurs-porteurs-pour-une-reconversion-professionnelle/;les-metiers-en-vogue-explorer-les-secteurs-porteurs-pour-une-reconversion-professionnelle;Les métiers en vogue : explorer les secteurs porteurs pour une reconversion professionnelle - My Beautiful Job;En raison de l’évolution constante du marché du travail, il est important de rester à jour avec les tendances actuelles de l’emploi. Cela est particulièrement vrai pour ceux qui envisagent une reconversion professionnelle. Les métiers en vogue peuvent être une source d’inspiration pour ceux qui cherchent à changer de carrière. Dans cet article, nous allons explorer les secteurs porteurs pour une reconversion professionnelle. A voir aussi : Délai de prévenance : comment le calculer ? Plan de l'articleSecteur de la technologie : un domaine en constante évolutionSecteur de la santé : une industrie en constante expansionSecteur de l’énergie renouvelable : […];12/01/2025 01:01;12/01/2025 15:36;Justin005; Les métiers en vogue : explorer les secteurs porteurs pour une reconversion professionnelle;['Business', 'Business', 'Business', 'Business', 'Business', 'Business', 'Business', 'Emploi', 'Formation', 'Formation', 'Business', 'Emploi'];1708;4.0;None;None;1;2;569.3333333333334;17080.0;https://www.mybeautifuljob.com;14/01/2025 22:17
https://www.mybeautifuljob.com/accedez-a-votre-messagerie-academique-nancy-metz-guide-detaille/;https://www.mybeautifuljob.com/accedez-a-votre-messagerie-academique-nancy-metz-guide-detaille/;https://www.mybeautifuljob.com/accedez-a-votre-messagerie-academique-nancy-metz-guide-detaille/;accedez-a-votre-messagerie-academique-nancy-metz-guide-detaille;Accédez à votre messagerie académique Nancy-Metz : guide détaillé - My Beautiful Job;L’accès à la messagerie académique Nancy-Metz est essentiel pour les étudiants, les enseignants et le personnel administratif. Ce service permet de rester connecté, d’échanger des informations importantes et de gérer les communications officielles. La messagerie académique est intégrée dans le quotidien des utilisateurs, facilitant la gestion des cours, des travaux et des notifications officielles. Pour ceux qui ne sont pas familiers avec cette plateforme, naviguer dans l’interface peut sembler déroutant au début. Heureusement, une série d’étapes simples permet de se connecter facilement et de tirer le meilleur parti de cet outil indispensable. Suivez ces instructions pour accéder à votre messagerie […];12/01/2025 01:01;12/01/2025 15:36;Watson; Accédez à votre messagerie académique Nancy-Metz : guide détaillé;['Formation', 'Formation', 'Formation', 'Formation', 'Formation', 'Formation', 'Formation', 'Actu', 'Emploi', 'Business', 'Business', 'Emploi'];741;3.0;None;None;1;2;247.0;7410.0;https://www.mybeautifuljob.com;14/01/2025 22:17
https://www.mybeautifuljob.com/ma-classe-en-auvergne-plateforme-educative-regionale/;https://www.mybeautifuljob.com/ma-classe-en-auvergne-plateforme-educative-regionale/;https://www.mybeautifuljob.com/ma-classe-en-auvergne-plateforme-educative-regionale/;ma-classe-en-auvergne-plateforme-educative-regionale;Ma classe en Auvergne : Plateforme éducative régionale - My Beautiful Job;Au cœur de l’Auvergne, une initiative novatrice a vu le jour pour transformer l’expérience éducative : la plateforme ‘Ma classe en Auvergne’. Cet outil numérique régional a été conçu pour enrichir le parcours scolaire des élèves et soutenir les enseignants dans leur mission. En mettant à disposition des ressources pédagogiques variées et adaptées aux programmes locaux, cette plateforme favorise une approche personnalisée de l’enseignement. Elle permet aussi de tisser un lien plus fort entre les établissements scolaires et l’environnement culturel, historique et naturel unique de la région, engageant les élèves dans un apprentissage qui fait écho à leur patrimoine. Plan […];12/01/2025 01:01;12/01/2025 15:36;Watson; Ma classe en Auvergne : Plateforme éducative régionale;['Formation', 'Formation', 'Formation', 'Formation', 'Formation', 'Formation', 'Formation', 'Actu', 'Emploi', 'Emploi', 'Business', 'Emploi'];805;5.0;None;None;1;2;268.3333333333333;8049.999999999999;https://www.mybeautifuljob.com;14/01/2025 22:17
https://www.mybeautifuljob.com/ediflex-plateforme-educative-pour-un-apprentissage-flexible/;https://www.mybeautifuljob.com/ediflex-plateforme-educative-pour-un-apprentissage-flexible/;https://www.mybeautifuljob.com/ediflex-plateforme-educative-pour-un-apprentissage-flexible/;ediflex-plateforme-educative-pour-un-apprentissage-flexible;Ediflex : Plateforme éducative pour un apprentissage flexible - My Beautiful Job;Dans un monde où l’éducation est en constante évolution, la plateforme Ediflex se distingue comme une solution innovante. Conçue pour s’adapter aux besoins variés des apprenants modernes, elle offre une expérience d’apprentissage sur mesure. Que ce soit pour des étudiants en quête de compléments pédagogiques, des professionnels cherchant à actualiser leurs compétences ou des enseignants désireux d’enrichir leurs méthodes d’enseignement, Ediflex fournit des outils et des contenus versatiles. Sa flexibilité permet une intégration harmonieuse de l’apprentissage en ligne avec les méthodologies traditionnelles, créant ainsi un environnement d’apprentissage dynamique et interactif. Plan de l'articleEdiflex : une révolution dans l’apprentissage en ligneLes […];12/01/2025 01:01;12/01/2025 15:36;Watson; Ediflex : Plateforme éducative pour un apprentissage flexible;['Formation', 'Formation', 'Formation', 'Formation', 'Formation', 'Formation', 'Formation', 'Formation', 'Actu', 'Actu', 'Business', 'Emploi'];786;4.0;None;None;1;2;262.0;7860.0;https://www.mybeautifuljob.com;14/01/2025 22:17
