Column1;article_url;article_canonical_url;article_slug;article_meta_title;article_meta_desc;article_date_published;article_date_modified;article_author;article_title;article_category;article_views;article_reading_time;article_content;article_raw_content;article_length;days_since_published;article_views_daily;article_views_monthly;website;scraping_date
https://www.mybeautifuljob.com/les-meilleures-formations-pour-une-reconversion-reussie-dans-des-secteurs-davenir/;https://www.mybeautifuljob.com/les-meilleures-formations-pour-une-reconversion-reussie-dans-des-secteurs-davenir/;https://www.mybeautifuljob.com/les-meilleures-formations-pour-une-reconversion-reussie-dans-des-secteurs-davenir/;les-meilleures-formations-pour-une-reconversion-reussie-dans-des-secteurs-davenir;Les meilleures formations pour une reconversion réussie dans des secteurs d'avenir - My Beautiful Job;Dans un monde en constante évolution, les métiers d’aujourd’hui peuvent ne pas être ceux de demain. Alors que l’automatisation et l’innovation technologique façonnent nos vies, il faut se tenir au courant des compétences requises dans cette nouvelle ère. Les individus cherchant à faire une reconversion professionnelle se tournent vers des secteurs d’avenir prometteurs, tels que l’intelligence artificielle, la data science, la cybersécurité, etc. Pour cela, ils recherchent des formations de qualité pour se préparer à ces nouveaux défis. Voici une sélection des meilleures formations disponibles pour réussir une reconversion dans ces secteurs en plein essor. Plan de l'articleSecteurs d’avenir : […];27/11/2023 01:01;27/11/2023 13:15;Watson; Les meilleures formations pour une reconversion réussie dans des secteurs d’avenir;['Actu', 'Actu', 'Actu', 'Actu', 'Actu', 'Actu', 'Actu', 'Actu', 'Formation', 'Emploi', 'Business', 'Emploi'];1136;6.0;None;None;1;414;2.7373493975903616;82.12048192771084;https://www.mybeautifuljob.com;14/01/2025 22:17
https://www.mybeautifuljob.com/trouver-un-emploi-a-ploermel-conseils-offres-et-opportunites-professionnelles/;https://www.mybeautifuljob.com/trouver-un-emploi-a-ploermel-conseils-offres-et-opportunites-professionnelles/;https://www.mybeautifuljob.com/trouver-un-emploi-a-ploermel-conseils-offres-et-opportunites-professionnelles/;trouver-un-emploi-a-ploermel-conseils-offres-et-opportunites-professionnelles;Trouver un emploi à Ploërmel : conseils, offres et opportunités professionnelles - My Beautiful Job;Ploërmel, petite ville bretonne dynamique, offre une variété d’emplois dans des secteurs divers. De l’industrie à l’agriculture, en passant par les services, les opportunités professionnelles sont nombreuses. La recherche d’emploi peut s’avérer difficile sans les outils adéquats et les bonnes stratégies. Que vous soyez demandeur d’emploi, en reconversion professionnelle ou fraîchement diplômé, ce guide vous fournira des conseils précieux pour maximiser vos chances de réussite. Il vous mettra aussi en relation avec des offres d’emploi locales, des informations sur le marché du travail à Ploërmel et les secteurs qui recrutent. Ploërmel : conseils et astuces pour les opportunités professionnelles (79 […];27/11/2023 01:01;27/11/2023 13:15;Watson; Trouver un emploi à Ploërmel : conseils, offres et opportunités professionnelles;['Emploi', 'Emploi', 'Emploi', 'Emploi', 'Emploi', 'Emploi', 'Emploi', 'Formation', 'Actu', 'Emploi', 'Business', 'Emploi'];1056;5.0;None;None;1;414;2.544578313253012;76.33734939759036;https://www.mybeautifuljob.com;14/01/2025 22:17
https://www.mybeautifuljob.com/quels-sont-les-metiers-les-plus-demandes-en-interim/;https://www.mybeautifuljob.com/quels-sont-les-metiers-les-plus-demandes-en-interim/;https://www.mybeautifuljob.com/quels-sont-les-metiers-les-plus-demandes-en-interim/;quels-sont-les-metiers-les-plus-demandes-en-interim;Quels sont les métiers les Plus Demandés en Intérim ? - My Beautiful Job;L’intérim est un secteur qui connaît une demande croissante et diversifiée. En fonction des évolutions économiques et technologiques, certains métiers se distinguent par une demande accrue de la part des entreprises. Découvrons ensemble quels sont les métiers qui ont le vent en poupe dans le monde de l’intérim. A lire en complément : Les bienfaits de la formation continue pour dynamiser sa carrière Plan de l'articleSecteur IndustrielBâtiment et Travaux PublicsLogistique et TransportSecteur TertiaireEt vous dans tout ça ? Secteur Industriel Le domaine industriel est traditionnellement un grand pourvoyeur d’emplois intérimaires. Les besoins fluctuent en fonction des commandes, des saisons et […];27/11/2023 01:01;14/02/2024 06:58;smartuser; Quels sont les métiers les Plus Demandés en Intérim ?;['Emploi', 'Emploi', 'Emploi', 'Emploi', 'Emploi', 'Emploi', 'Emploi', 'Emploi', 'Actu', 'Business', 'Business', 'Emploi'];1128;2.0;None;None;1;414;2.7180722891566265;81.5421686746988;https://www.mybeautifuljob.com;14/01/2025 22:17
https://www.mybeautifuljob.com/5-raisons-de-choisir-une-carriere-dinfirmiere/;https://www.mybeautifuljob.com/5-raisons-de-choisir-une-carriere-dinfirmiere/;https://www.mybeautifuljob.com/5-raisons-de-choisir-une-carriere-dinfirmiere/;5-raisons-de-choisir-une-carriere-dinfirmiere;5 raisons de choisir une carrière d'infirmière - My Beautiful Job;Vous souhaitez exercer le métier d’infirmière ? Il y a peu de professions qui offrent les mêmes avantages que celle d’infirmier. Les professionnels de ce domaine travaillent avec des personnes intéressantes et impactent considérablement la vie des gens qu’ils rencontrent. Par conséquent, cette carrière peut être idéale pour de nombreuses raisons. Découvrez 5 raisons de devenir infirmière et d’entamer une carrière enrichissante. Plan de l'articleUne formation accessible à tous pour devenir infirmièreFaites la différence en exerçant un métier de passionChoisissez de travailler dans une grande variété d’environnementsLes hôpitaux et les cliniquesLes infirmières à domicileInfirmière : un métier respecté de tousChoisissez […];27/11/2023 01:01;05/12/2023 13:11;Nico; 5 raisons de choisir une carrière d’infirmière;['Emploi', 'Emploi', 'Emploi', 'Emploi', 'Emploi', 'Emploi', 'Emploi', 'Actu', 'Formation', 'Formation', 'Business', 'Emploi'];1762;6.0;None;None;1;414;4.2457831325301205;127.37349397590361;https://www.mybeautifuljob.com;14/01/2025 22:17
https://www.mybeautifuljob.com/quest-ce-quun-officier-en-chef-du-bonheur/;https://www.mybeautifuljob.com/quest-ce-quun-officier-en-chef-du-bonheur/;https://www.mybeautifuljob.com/quest-ce-quun-officier-en-chef-du-bonheur/;quest-ce-quun-officier-en-chef-du-bonheur;Qu'est-ce qu'un Officier en chef du bonheur ? - My Beautiful Job;RÉSUMÉ DE L’ARTICLE protection sociale au travail La protection sociale au travail a été l’un des critères les plus importants pour les employés ces dernières années. La Missions du dirigeant principal du bonheur Où trouver Le bonheur en chef Comment devons-nous devenir chef du bonheur ? Formation pour devenir chef du bonheur Qui a besoin d’un directeur du bonheur ? Conclusion sur le chef Agent du Bonheur Définition du gestionnaire du bonheur Si vous ne connaissez pas le chef du bonheur, il se peut que le bien-être au travail puisse déjà être gagné pour vous, ou vous n’avez pas encore entendu parler […];27/11/2023 01:01;27/11/2023 13:14;Tangi; Qu’est-ce qu’un Officier en chef du bonheur ?;['Emploi', 'Emploi', 'Emploi', 'Emploi', 'Emploi', 'Emploi', 'Emploi', 'Actu', 'Formation', 'Emploi', 'Business', 'Emploi'];2275;8.0;None;None;1;414;5.481927710843373;164.45783132530119;https://www.mybeautifuljob.com;14/01/2025 22:17
https://www.mybeautifuljob.com/trouver-un-emploi-a-belleville-en-beaujolais-conseils-et-opportunites/;https://www.mybeautifuljob.com/trouver-un-emploi-a-belleville-en-beaujolais-conseils-et-opportunites/;https://www.mybeautifuljob.com/trouver-un-emploi-a-belleville-en-beaujolais-conseils-et-opportunites/;trouver-un-emploi-a-belleville-en-beaujolais-conseils-et-opportunites;Trouver un emploi à Belleville-en-Beaujolais : conseils et opportunités - My Beautiful Job;Belleville-en-Beaujolais, charmante ville française située dans la région viticole du Beaujolais, se caractérise par ses paysages pittoresques et sa riche histoire. Toutefois, au-delà de ces attraits, c’est une localité dynamique présentant un marché de l’emploi en expansion. Les demandeurs d’emploi y trouveront une variété d’opportunités allant des industries traditionnelles à des domaines plus modernes. Le présent écrit offre des pistes et astuces pour naviguer efficacement à travers ce paysage professionnel. Que vous soyez un résident de longue date ou un nouvel arrivant, ces conseils pourraient vous aider à décrocher un poste à Belleville-en-Beaujolais. Belleville-en-Beaujolais : terre d’opportunités pro Au cœur […];23/11/2023 00:00;;Watson; Trouver un emploi à Belleville-en-Beaujolais : conseils et opportunités;['Emploi', 'Emploi', 'Emploi', 'Emploi', 'Emploi', 'Emploi', 'Emploi', 'Emploi', 'Business', 'Formation', 'Business', 'Emploi'];1001;3.0;None;None;1;418;2.389021479713604;71.67064439140812;https://www.mybeautifuljob.com;14/01/2025 22:17
https://www.mybeautifuljob.com/toefl-quatre-raisons-de-passer-ce-test/;https://www.mybeautifuljob.com/toefl-quatre-raisons-de-passer-ce-test/;https://www.mybeautifuljob.com/toefl-quatre-raisons-de-passer-ce-test/;toefl-quatre-raisons-de-passer-ce-test;TOEFL : Quatre raisons de passer ce test ! - My Beautiful Job;Le Test of English as a Foreign Language (TOEFL) permet de certifier les compétences linguistiques en anglais de personnes non anglophones. Cet examen est le plus populaire au monde. Chaque année, il est passé par plus de 2,5 millions d’étudiants, professionnels et particuliers. Mais, quelle est son utilité ? Découvrez dans la suite de cet article les raisons de passer le test TOEFL. Plan de l'articleAdmission dans des écoles internationalesValoriser son curriculum vitaeObtenir un visa d’étudiantAméliorer ses compétences linguistiques Admission dans des écoles internationales La plupart des universités et établissements d’enseignement supérieur étrangers exigent de disposer d’un certain niveau en […];20/11/2023 18:06;14/02/2024 06:58;smartuser; TOEFL : Quatre raisons de passer ce test !;['Formation', 'Formation', 'Formation', 'Formation', 'Formation', 'Formation', 'Formation', 'Business', 'Formation', 'Business', 'Business', 'Emploi'];1058;3.0;None;None;1;421;2.5071090047393363;75.2132701421801;https://www.mybeautifuljob.com;14/01/2025 22:17
https://www.mybeautifuljob.com/les-competences-incontournables-pour-reussir-sur-le-marche-du-travail/;https://www.mybeautifuljob.com/les-competences-incontournables-pour-reussir-sur-le-marche-du-travail/;https://www.mybeautifuljob.com/les-competences-incontournables-pour-reussir-sur-le-marche-du-travail/;les-competences-incontournables-pour-reussir-sur-le-marche-du-travail;Les compétences incontournables pour réussir sur le marché du travail - My Beautiful Job;Dans le panorama actuel du travail, où l’incertitude et l’évolution rapide définissent le paysage, le succès nécessite un arsenal de compétences. Le monde professionnel est en constante mutation, rendant certaines habiletés indispensables pour se démarquer et réussir. Effectivement, l’adaptabilité, la résilience, la pensée critique sont autant de qualités recherchées par les recruteurs. L’ère numérique a fait naître une demande croissante pour les compétences techniques. Mais celles-ci ne suffisent plus, les compétences douces, ou soft skills, gagnent en importance. Comprendre et développer ces compétences incontournables est devenu essentiel pour naviguer avec succès sur le marché du travail. Plan de l'articleMarché du […];19/11/2023 01:01;19/11/2023 08:18;Watson; Les compétences incontournables pour réussir sur le marché du travail;['Emploi', 'Emploi', 'Emploi', 'Emploi', 'Emploi', 'Emploi', 'Emploi', 'Business', 'Emploi', 'Formation', 'Business', 'Emploi'];1023;5.0;None;None;1;422;2.4184397163120566;72.5531914893617;https://www.mybeautifuljob.com;14/01/2025 22:17
https://www.mybeautifuljob.com/les-meilleures-facons-de-financer-sa-formation-professionnelle/;https://www.mybeautifuljob.com/les-meilleures-facons-de-financer-sa-formation-professionnelle/;https://www.mybeautifuljob.com/les-meilleures-facons-de-financer-sa-formation-professionnelle/;les-meilleures-facons-de-financer-sa-formation-professionnelle;Les meilleures façons de financer sa formation professionnelle - My Beautiful Job;L’évolution constante du paysage économique mondial impose une adaptation perpétuelle des compétences. En ce sens, se former tout au long de sa carrière n’est plus un luxe, mais une nécessité. Toutefois, la principale entrave à cet impératif reste souvent le coût. Comment donc alléger ce fardeau financier sans compromettre la qualité de l’apprentissage ? Quelles sont les meilleures options pour financer sa formation professionnelle ? Tour d’horizon des pistes à actionner, des aides publiques aux prêts d’honneur, en passant par le mécénat d’entreprise et les plateformes pour le financement participatif. Plan de l'articleFormation sur mesure : choisir celle qui vous […];19/11/2023 01:01;19/11/2023 08:18;Watson; Les meilleures façons de financer sa formation professionnelle;['Actu', 'Actu', 'Actu', 'Actu', 'Actu', 'Actu', 'Actu', 'Emploi', 'Formation', 'Formation', 'Business', 'Emploi'];1112;5.0;None;None;1;422;2.6288416075650116;78.86524822695034;https://www.mybeautifuljob.com;14/01/2025 22:17
https://www.mybeautifuljob.com/les-metiers-du-futur-et-les-formations-pour-sy-preparer/;https://www.mybeautifuljob.com/les-metiers-du-futur-et-les-formations-pour-sy-preparer/;https://www.mybeautifuljob.com/les-metiers-du-futur-et-les-formations-pour-sy-preparer/;les-metiers-du-futur-et-les-formations-pour-sy-preparer;Les métiers du futur et les formations pour s'y préparer - My Beautiful Job;L’ère numérique façonne activement notre réalité, donnant naissance à de nouvelles professions et redéfinissant les anciennes. L’évolution technologique rapide et l’essor de l’intelligence artificielle créent une demande croissante pour des compétences spécifiques. La transition vers une économie verte génère des opportunités inédites. Face à ces changements, l’éducation et la formation jouent un rôle crucial pour préparer efficacement les travailleurs de demain. Qu’il s’agisse de formations académiques, de formations professionnelles ou d’apprentissage tout au long de la vie, l’adaptation aux métiers du futur est essentielle pour maintenir une économie dynamique et compétitive. Plan de l'articleLes métiers du futur : quelles tendances […];19/11/2023 01:01;19/11/2023 08:18;Watson; Les métiers du futur et les formations pour s’y préparer;['Emploi', 'Emploi', 'Emploi', 'Emploi', 'Emploi', 'Emploi', 'Emploi', 'Business', 'Emploi', 'Emploi', 'Business', 'Emploi'];1126;4.0;None;None;1;422;2.66193853427896;79.8581560283688;https://www.mybeautifuljob.com;14/01/2025 22:17
https://www.mybeautifuljob.com/guide-ultime-pour-choisir-la-meilleure-formation-professionnelle/;https://www.mybeautifuljob.com/guide-ultime-pour-choisir-la-meilleure-formation-professionnelle/;https://www.mybeautifuljob.com/guide-ultime-pour-choisir-la-meilleure-formation-professionnelle/;guide-ultime-pour-choisir-la-meilleure-formation-professionnelle;Guide ultime pour choisir la meilleure formation professionnelle - My Beautiful Job;Naviguer dans l’océan complexe des options de formation professionnelle peut sembler une tâche ardue. Les choix sont infinis, allant des cours en ligne aux certifications professionnelles, en passant par des diplômes universitaires spécialisés. L’objectif final est d’améliorer ses compétences et de se positionner favorablement sur le marché du travail. Comment faire le bon choix ? Quels sont les éléments à prendre en compte lors de la sélection de la bonne formation professionnelle ? C’est précisément ce que je vais tenter de démontrer dans ce guide ultime pour choisir la meilleure formation professionnelle. Plan de l'articleL’importance de la formation professionnelle : […];19/11/2023 01:01;19/11/2023 08:19;Watson; Guide ultime pour choisir la meilleure formation professionnelle;['Emploi', 'Emploi', 'Emploi', 'Emploi', 'Emploi', 'Emploi', 'Emploi', 'Formation', 'Formation', 'Business', 'Business', 'Emploi'];1342;5.0;None;None;1;422;3.1725768321513;95.177304964539;https://www.mybeautifuljob.com;14/01/2025 22:17
https://www.mybeautifuljob.com/passionne-de-bien-etre-et-si-vous-deveniez-naturopathe/;https://www.mybeautifuljob.com/passionne-de-bien-etre-et-si-vous-deveniez-naturopathe/;https://www.mybeautifuljob.com/passionne-de-bien-etre-et-si-vous-deveniez-naturopathe/;passionne-de-bien-etre-et-si-vous-deveniez-naturopathe;Passionné de bien-être : et si vous deveniez naturopathe ? - My Beautiful Job;Devenir naturopathe constitue l’une des meilleures décisions que vous pouvez prendre lorsque vous êtes un passionné de bien-être. La naturopathie est une médecine alternative qui permettrait de préserver sa santé à travers des méthodes douces. Cependant, comment pouvez-vous vous former si vous souhaitez vous lancer dans cette profession ? Plan de l'articleQu’est-ce que la naturopathie et pourquoi vous lancer dans ce métier ?Comment entamer votre parcours pour devenir naturopathe ?Que pouvez-vous faire en tant que naturopathe ? Qu’est-ce que la naturopathie et pourquoi vous lancer dans ce métier ? La naturopathie fait appel à différentes médecines traditionnelles comme l’ayurveda. Elle […];15/11/2023 16:14;05/12/2023 21:05;Nico; Passionné de bien-être : et si vous deveniez naturopathe ?;['Emploi', 'Emploi', 'Emploi', 'Emploi', 'Emploi', 'Emploi', 'Emploi', 'Actu', 'Formation', 'Emploi', 'Business', 'Emploi'];1064;4.0;None;None;1;426;2.4918032786885247;74.75409836065575;https://www.mybeautifuljob.com;14/01/2025 22:17
https://www.mybeautifuljob.com/trouver-la-formation-ideale-pour-atteindre-vos-objectifs/;https://www.mybeautifuljob.com/trouver-la-formation-ideale-pour-atteindre-vos-objectifs/;https://www.mybeautifuljob.com/trouver-la-formation-ideale-pour-atteindre-vos-objectifs/;trouver-la-formation-ideale-pour-atteindre-vos-objectifs;Trouver la formation idéale pour atteindre vos objectifs - My Beautiful Job;Dans ce monde en constante évolution, l’éducation et la formation continue sont devenues une nécessité pour rester à jour et compétitif. Pourtant, il n’est pas toujours aisé de discerner quelle formation serait la plus appropriée pour répondre à des objectifs précis. Avec une pléthore d’options disponibles, des universités traditionnelles aux plateformes en ligne, vous devez naviguer judicieusement pour faire le meilleur choix. Qu’il s’agisse de progresser dans une carrière existante, de changer de voie ou simplement d’apprendre de nouvelles compétences, la formation idéale pourrait ne pas être loin, à condition de savoir où et comment chercher. Plan de l'articleFixez vos […];14/11/2023 01:01;14/11/2023 13:24;Watson; Trouver la formation idéale pour atteindre vos objectifs;['Business', 'Business', 'Business', 'Business', 'Business', 'Business', 'Business', 'Business', 'Emploi', 'Business', 'Business', 'Emploi'];1067;7.0;None;None;1;427;2.4929906542056073;74.78971962616822;https://www.mybeautifuljob.com;14/01/2025 22:17
https://www.mybeautifuljob.com/les-dernieres-avancees-technologiques-au-service-de-la-formation/;https://www.mybeautifuljob.com/les-dernieres-avancees-technologiques-au-service-de-la-formation/;https://www.mybeautifuljob.com/les-dernieres-avancees-technologiques-au-service-de-la-formation/;les-dernieres-avancees-technologiques-au-service-de-la-formation;Les dernières avancées technologiques au service de la formation - My Beautiful Job;Dans un monde en constante évolution, l’éducation et la formation ne sont pas en reste et bénéficient des progrès technologiques fulgurants. L’émergence des nouvelles technologies a bouleversé les modes d’apprentissage traditionnels, ouvrant la voie à des méthodes plus innovantes et efficaces. De l’apprentissage mobile aux cours en ligne, en passant par la réalité virtuelle, l’intelligence artificielle et les jeux sérieux, la technologie offre un éventail d’outils pédagogiques qui remodèlent l’enseignement et la formation. Ces avancées promettent une éducation plus personnalisée, flexible et accessible à tous, indépendamment du lieu et du temps. Plan de l'articleFormation à l’ère numérique : une nouvelle […];14/11/2023 01:01;14/11/2023 13:24;Watson; Les dernières avancées technologiques au service de la formation;['Actu', 'Actu', 'Actu', 'Actu', 'Actu', 'Actu', 'Actu', 'Business', 'Business', 'Formation', 'Business', 'Emploi'];1126;6.0;None;None;1;427;2.630841121495327;78.9252336448598;https://www.mybeautifuljob.com;14/01/2025 22:17
https://www.mybeautifuljob.com/les-formations-incontournables-pour-booster-votre-carriere-professionnelle/;https://www.mybeautifuljob.com/les-formations-incontournables-pour-booster-votre-carriere-professionnelle/;https://www.mybeautifuljob.com/les-formations-incontournables-pour-booster-votre-carriere-professionnelle/;les-formations-incontournables-pour-booster-votre-carriere-professionnelle;Les formations incontournables pour booster votre carrière professionnelle - My Beautiful Job;Naviguer dans le monde du travail peut être un défi, surtout quand il s’agit de progresser et de faire évoluer sa carrière. L’acquisition de compétences supplémentaires est souvent la clé pour ouvrir de nouvelles portes. Les formations professionnelles offrent une occasion inestimable de développer ces compétences. Elles peuvent revêtir plusieurs formules, des certifications en ligne aux cursus universitaires, et couvrir une gamme variée de domaines indispensables à l’accomplissement professionnel. Éclaircir les formations essentielles qui peuvent donner un coup de pouce à votre carrière est donc un élément crucial pour ceux qui aspirent à grandir professionnellement. Plan de l'articleCarrière réussie : […];14/11/2023 01:01;14/11/2023 13:23;Watson; Les formations incontournables pour booster votre carrière professionnelle;['Formation', 'Formation', 'Formation', 'Formation', 'Formation', 'Formation', 'Formation', 'Actu', 'Actu', 'Emploi', 'Business', 'Emploi'];1090;7.0;None;None;1;427;2.546728971962617;76.40186915887851;https://www.mybeautifuljob.com;14/01/2025 22:17
https://www.mybeautifuljob.com/trouver-la-formation-ideale-pour-propulser-votre-carriere/;https://www.mybeautifuljob.com/trouver-la-formation-ideale-pour-propulser-votre-carriere/;https://www.mybeautifuljob.com/trouver-la-formation-ideale-pour-propulser-votre-carriere/;trouver-la-formation-ideale-pour-propulser-votre-carriere;Trouver la formation idéale pour propulser votre carrière - My Beautiful Job;Naviguer dans le labyrinthe des choix de formation peut être une tâche ardue pour beaucoup. Avec le bon éclairage, il est possible de distinguer la voie idéale pour propulser votre carrière vers de nouveaux sommets. C’est une question de découverte de soi, de compréhension des forces et des faiblesses personnelles, ainsi que de l’identification des compétences nécessaires pour exceller dans le domaine de carrière choisi. Que ce soit en matière de technologies émergentes, de gestion d’entreprise ou d’art créatif, il existe une formation spécialement adaptée à vos aspirations et vos besoins. Plan de l'articleLes clés d’une carrière réussieLes obstacles de […];14/11/2023 01:01;14/11/2023 13:24;Watson; Trouver la formation idéale pour propulser votre carrière;['Actu', 'Actu', 'Actu', 'Actu', 'Actu', 'Actu', 'Actu', 'Actu', 'Business', 'Formation', 'Business', 'Emploi'];1102;7.0;None;None;1;427;2.574766355140187;77.24299065420561;https://www.mybeautifuljob.com;14/01/2025 22:17
https://www.mybeautifuljob.com/trouver-la-formation-ideale-pour-atteindre-ses-objectifs-professionnels/;https://www.mybeautifuljob.com/trouver-la-formation-ideale-pour-atteindre-ses-objectifs-professionnels/;https://www.mybeautifuljob.com/trouver-la-formation-ideale-pour-atteindre-ses-objectifs-professionnels/;trouver-la-formation-ideale-pour-atteindre-ses-objectifs-professionnels;Trouver la formation idéale pour atteindre ses objectifs professionnels - My Beautiful Job;Naviguer dans le vaste océan des options de formation peut être une tâche intimidante. Choisir la bonne voie pour atteindre des objectifs professionnels spécifiques nécessite une réflexion stratégique approfondie. Les futurs étudiants doivent considérer non seulement leur passion et leurs compétences, mais aussi les réalités du marché du travail. Les formations disponibles sont diverses et variées, allant des diplômes traditionnels aux certifications en ligne contemporaines. Les attentes professionnelles, les perspectives de carrière, le coût et la durée des études sont autant de facteurs à prendre en compte. L’objectif est de trouver la formation qui correspond parfaitement à la vision de […];14/11/2023 01:01;14/11/2023 13:24;Watson; Trouver la formation idéale pour atteindre ses objectifs professionnels;['Emploi', 'Emploi', 'Emploi', 'Emploi', 'Emploi', 'Emploi', 'Emploi', 'Formation', 'Emploi', 'Actu', 'Business', 'Emploi'];1118;5.0;None;None;1;427;2.6121495327102804;78.3644859813084;https://www.mybeautifuljob.com;14/01/2025 22:17
